training_code,status,trainer,startDate,endDate,participant_user,participant_hackerRankScore,participant_assessmentScore,participant_performance,participant_communication,participant_remarks
ST-074,completed,2de7903f689142b3bcab86fb,2024-05-29 16:05:20,2024-06-17 16:05:20,448aedcdd3854ffeb37c06e6,0,3,4,1,Little reduce party sense.
ST-074,completed,2de7903f689142b3bcab86fb,2024-05-29 16:05:20,2024-06-17 16:05:20,c5659b5b2d614b978a4c3985,2,1,9,3,Pretty stand former wind determine ground can.
ST-074,completed,2de7903f689142b3bcab86fb,2024-05-29 16:05:20,2024-06-17 16:05:20,df0706e6572d4f699543426f,5,9,9,7,Deal west close never sell.
ST-074,completed,2de7903f689142b3bcab86fb,2024-05-29 16:05:20,2024-06-17 16:05:20,8db611f5169e402da944c7b9,6,7,8,1,Early avoid hope war.
ST-074,completed,2de7903f689142b3bcab86fb,2024-05-29 16:05:20,2024-06-17 16:05:20,4925980026da48c2b25fa3b7,3,4,3,1,Rather debate tell pattern wall front.
FS-075,completed,c76226e51b37475cb1aae562,2024-07-11 17:51:12,2024-07-16 17:51:12,2308af8dee654be280fae109,2,8,5,3,In statement book investment gas.
FS-075,completed,c76226e51b37475cb1aae562,2024-07-11 17:51:12,2024-07-16 17:51:12,9b40dba9d6b941ee956fddfc,2,2,8,8,Take various discussion long service difficult born.
FS-075,completed,c76226e51b37475cb1aae562,2024-07-11 17:51:12,2024-07-16 17:51:12,f5699d41c890467893895a7d,3,10,7,6,It need democratic body executive majority fear.
FS-075,completed,c76226e51b37475cb1aae562,2024-07-11 17:51:12,2024-07-16 17:51:12,be362aa6d18243d6b4c7d5c6,0,2,8,1,Paper leader stop hard forget suffer.
FS-075,completed,c76226e51b37475cb1aae562,2024-07-11 17:51:12,2024-07-16 17:51:12,429c2f1ebb4148d1a3f0e43a,8,1,1,4,Conference hotel response together city trade lay.
FS-075,completed,c76226e51b37475cb1aae562,2024-07-11 17:51:12,2024-07-16 17:51:12,4bdd0a4c736b4e62960b7258,6,5,0,8,Than receive off tree tonight without.
FS-075,completed,c76226e51b37475cb1aae562,2024-07-11 17:51:12,2024-07-16 17:51:12,fdaeb59040294e6dadd84e79,7,10,9,1,Amount company see only key relate.
FS-075,completed,c76226e51b37475cb1aae562,2024-07-11 17:51:12,2024-07-16 17:51:12,2278f30f19884694bc442320,6,8,2,6,Blood nice idea tend manager partner tend she.
FS-075,completed,c76226e51b37475cb1aae562,2024-07-11 17:51:12,2024-07-16 17:51:12,ba9e3ff81c2f44aaa30fa085,4,8,7,2,Low situation type later article.
FS-075,completed,c76226e51b37475cb1aae562,2024-07-11 17:51:12,2024-07-16 17:51:12,fba68e5544444bae8bb127e5,5,8,3,8,Contain myself education bed professional difference.
UI-076,pending,826b0a1be5464f16a109bb6b,2024-01-29 19:33:11,2024-02-02 19:33:11,c8e9a796448d4340892de589,2,7,0,6,Majority meeting yet perform hope apply.
UI-076,pending,826b0a1be5464f16a109bb6b,2024-01-29 19:33:11,2024-02-02 19:33:11,2786d8f9853f4d128a12bd85,5,10,4,5,Next various support fall cup.
UI-076,pending,826b0a1be5464f16a109bb6b,2024-01-29 19:33:11,2024-02-02 19:33:11,52bf5a67baf944e085c3558a,8,7,4,6,Put career energy little.
UI-076,pending,826b0a1be5464f16a109bb6b,2024-01-29 19:33:11,2024-02-02 19:33:11,24daab7588b640cdb57c8f73,3,8,9,7,Major provide require scientist skin but.
UI-076,pending,826b0a1be5464f16a109bb6b,2024-01-29 19:33:11,2024-02-02 19:33:11,0598ed55b9ee40858939841d,6,8,10,7,Worker exist service game behavior top.
UI-076,pending,826b0a1be5464f16a109bb6b,2024-01-29 19:33:11,2024-02-02 19:33:11,0223661f64764291a91eb393,4,1,3,9,Property this similar wear effort woman he.
UI-076,pending,826b0a1be5464f16a109bb6b,2024-01-29 19:33:11,2024-02-02 19:33:11,87f147efbcb348b4ab843249,2,4,7,3,Meeting actually western early this baby.
UI-076,pending,826b0a1be5464f16a109bb6b,2024-01-29 19:33:11,2024-02-02 19:33:11,f2f3449117a844c586ac7358,6,6,0,8,Bank now production piece figure Mr perhaps.
UI-076,pending,826b0a1be5464f16a109bb6b,2024-01-29 19:33:11,2024-02-02 19:33:11,eca088db92db43e582cd3dfc,4,1,2,5,Agency perhaps suddenly reduce support.
UI-076,pending,826b0a1be5464f16a109bb6b,2024-01-29 19:33:11,2024-02-02 19:33:11,8499838169164d8ab4828ce9,4,5,1,9,Significant site director sign leave wide tell.
UI-076,pending,826b0a1be5464f16a109bb6b,2024-01-29 19:33:11,2024-02-02 19:33:11,6904a6e9d8de411a946f1ad6,8,7,8,6,Tree south young occur full everything.
UI-076,pending,826b0a1be5464f16a109bb6b,2024-01-29 19:33:11,2024-02-02 19:33:11,3d854ba3d4f8452ea9ef5167,8,9,1,3,Task local treat beyond education order dark court.
UI-076,pending,826b0a1be5464f16a109bb6b,2024-01-29 19:33:11,2024-02-02 19:33:11,9dc5c1d175d04bbe94606502,9,1,6,8,Fill phone crime our impact clear mother center.
UI-076,pending,826b0a1be5464f16a109bb6b,2024-01-29 19:33:11,2024-02-02 19:33:11,a550962569904a65af13a195,3,4,1,2,Cover authority better none.
UI-076,pending,826b0a1be5464f16a109bb6b,2024-01-29 19:33:11,2024-02-02 19:33:11,9bede043ea4248f298c10f55,6,5,1,10,Ball where result action response.
UI-076,pending,826b0a1be5464f16a109bb6b,2024-01-29 19:33:11,2024-02-02 19:33:11,a82bd595037840d1a3e49895,3,1,6,6,Option always item defense what.
UI-076,pending,826b0a1be5464f16a109bb6b,2024-01-29 19:33:11,2024-02-02 19:33:11,967ae171bcbc489ab7514a7a,6,8,3,3,Worker forward ability wife center probably.
UI-076,pending,826b0a1be5464f16a109bb6b,2024-01-29 19:33:11,2024-02-02 19:33:11,0f3dd94a7c7046589aa5fa0a,6,6,9,3,Field feel throw argue a interest along.
UI-076,pending,826b0a1be5464f16a109bb6b,2024-01-29 19:33:11,2024-02-02 19:33:11,75c0eb864be444f9b9c72c27,9,8,7,3,Try I ten.
UI-076,pending,826b0a1be5464f16a109bb6b,2024-01-29 19:33:11,2024-02-02 19:33:11,ee0633bfebc947aead45f2f0,0,9,3,8,Author such draw feel they team space.
UI-076,pending,826b0a1be5464f16a109bb6b,2024-01-29 19:33:11,2024-02-02 19:33:11,5674b309cb524c7d9e9d38ad,5,3,4,2,Believe and parent soon.
UI-076,pending,826b0a1be5464f16a109bb6b,2024-01-29 19:33:11,2024-02-02 19:33:11,aa231520bb554c3f9a0c4655,3,3,8,10,Hair possible recent what behavior least impact.
UI-076,pending,826b0a1be5464f16a109bb6b,2024-01-29 19:33:11,2024-02-02 19:33:11,a4d6dec5c2844c658a12bdea,10,1,5,3,Claim Mrs later after letter sound baby.
UI-076,pending,826b0a1be5464f16a109bb6b,2024-01-29 19:33:11,2024-02-02 19:33:11,b07da6ad6b264ca8a3ad59f8,3,7,6,10,Recognize education help stand west different.
UI-076,pending,826b0a1be5464f16a109bb6b,2024-01-29 19:33:11,2024-02-02 19:33:11,88c89315fdb643a69c15e145,8,9,1,7,Challenge population factor why face young.
UI-076,pending,826b0a1be5464f16a109bb6b,2024-01-29 19:33:11,2024-02-02 19:33:11,5f50197b93214b63ad794314,8,6,9,9,Miss since where personal set pay camera house.
UI-076,pending,826b0a1be5464f16a109bb6b,2024-01-29 19:33:11,2024-02-02 19:33:11,1b994fc8e1a941b49e002c42,5,3,1,6,Could huge policy method dog garden.
UI-076,pending,826b0a1be5464f16a109bb6b,2024-01-29 19:33:11,2024-02-02 19:33:11,276c494511ff49b99cc8d3f5,3,8,3,6,Suggest baby well lead exactly ahead practice.
UI-076,pending,826b0a1be5464f16a109bb6b,2024-01-29 19:33:11,2024-02-02 19:33:11,4af38438ee2d48789266d42b,5,6,3,3,Couple strategy occur crime.
DS-077,completed,d11af3c5d0ec406c9e7a25c9,2024-06-18 18:42:33,2024-06-23 18:42:33,64a83955c07141f5829378c3,9,4,9,7,Everyone perform carry movie half scene pressure individual.
DS-077,completed,d11af3c5d0ec406c9e7a25c9,2024-06-18 18:42:33,2024-06-23 18:42:33,cbb45c9e867f407c95e86656,9,1,3,7,Affect long why throw school.
DS-077,completed,d11af3c5d0ec406c9e7a25c9,2024-06-18 18:42:33,2024-06-23 18:42:33,25133e6898c6468fb0a710b8,4,6,2,7,Price citizen experience main program now itself.
DS-077,completed,d11af3c5d0ec406c9e7a25c9,2024-06-18 18:42:33,2024-06-23 18:42:33,62bbf5482c274d408737fa4d,3,4,4,8,Daughter music should entire very your moment.
DS-077,completed,d11af3c5d0ec406c9e7a25c9,2024-06-18 18:42:33,2024-06-23 18:42:33,d9e41572266b4e909b2c88c2,5,4,4,10,National large parent get court of remember.
DS-077,completed,d11af3c5d0ec406c9e7a25c9,2024-06-18 18:42:33,2024-06-23 18:42:33,06871f00809d41e58a542b90,3,9,9,1,Risk past friend car strategy.
DS-077,completed,d11af3c5d0ec406c9e7a25c9,2024-06-18 18:42:33,2024-06-23 18:42:33,bdc9c10082aa4f4695c6ec50,8,7,7,9,Cultural threat cut western detail meeting.
DS-077,completed,d11af3c5d0ec406c9e7a25c9,2024-06-18 18:42:33,2024-06-23 18:42:33,18e38ad25de842e8a23e9c36,6,0,1,7,Data gun citizen amount.
DS-077,completed,d11af3c5d0ec406c9e7a25c9,2024-06-18 18:42:33,2024-06-23 18:42:33,085d1992c0634bea8394e5c5,6,1,7,8,Lot to win.
DS-077,completed,d11af3c5d0ec406c9e7a25c9,2024-06-18 18:42:33,2024-06-23 18:42:33,6d780db54de94b418d7c1ed4,10,5,5,3,Start quite experience myself book high light.
DS-077,completed,d11af3c5d0ec406c9e7a25c9,2024-06-18 18:42:33,2024-06-23 18:42:33,2c12929a4e994814b1875d12,2,3,2,2,Agree staff hope expert the long choice director.
DS-077,completed,d11af3c5d0ec406c9e7a25c9,2024-06-18 18:42:33,2024-06-23 18:42:33,5f22f0db21dc4faa94c09aa1,6,8,3,4,Of point later.
DS-077,completed,d11af3c5d0ec406c9e7a25c9,2024-06-18 18:42:33,2024-06-23 18:42:33,a3cd1a4a496048d1a58558d5,4,8,3,8,Politics travel couple may meeting.
DS-077,completed,d11af3c5d0ec406c9e7a25c9,2024-06-18 18:42:33,2024-06-23 18:42:33,de8e8d727b6b4a65952d120d,3,6,0,5,Effect good child want site crime at.
DS-077,completed,d11af3c5d0ec406c9e7a25c9,2024-06-18 18:42:33,2024-06-23 18:42:33,74b3e461570f49c18944bf81,7,10,6,2,Will feeling scene model discuss rise.
DS-077,completed,d11af3c5d0ec406c9e7a25c9,2024-06-18 18:42:33,2024-06-23 18:42:33,57a66945e48945b18ba8614b,1,2,5,9,Population one training at always article college them.
DS-077,completed,d11af3c5d0ec406c9e7a25c9,2024-06-18 18:42:33,2024-06-23 18:42:33,c59ae8d0942c438088d0bd5f,8,6,6,8,Money guess staff.
DS-077,completed,d11af3c5d0ec406c9e7a25c9,2024-06-18 18:42:33,2024-06-23 18:42:33,ddaa4b7ea3404f0e8cbc8c27,9,1,10,6,Economic stop already memory example a.
DS-077,completed,d11af3c5d0ec406c9e7a25c9,2024-06-18 18:42:33,2024-06-23 18:42:33,97e7c6b24dfa4715ac6dbbae,1,7,7,9,Base type church trade gun.
DS-077,completed,d11af3c5d0ec406c9e7a25c9,2024-06-18 18:42:33,2024-06-23 18:42:33,f1ab22d2178c48588fd8e250,1,0,8,1,Record capital option.
DS-077,completed,d11af3c5d0ec406c9e7a25c9,2024-06-18 18:42:33,2024-06-23 18:42:33,0ebcd5a99ac946b598141f7b,2,6,4,6,Enough may ok politics its.
DS-077,completed,d11af3c5d0ec406c9e7a25c9,2024-06-18 18:42:33,2024-06-23 18:42:33,05d402c73bcd4ebf96b85f03,5,2,7,4,Anyone make career.
DE-078,completed,d5e11e9a19804b7a9c39e066,2024-04-14 05:22:53,2024-04-17 05:22:53,36895ec3744d4adb97854290,6,2,6,2,Big thing onto miss.
DE-078,completed,d5e11e9a19804b7a9c39e066,2024-04-14 05:22:53,2024-04-17 05:22:53,5a7d90b02b514d128557535e,9,2,7,8,Study about east street career.
DE-078,completed,d5e11e9a19804b7a9c39e066,2024-04-14 05:22:53,2024-04-17 05:22:53,1bfb954dd6d640a2aa67f776,5,1,4,2,Smile board draw situation local song.
DE-078,completed,d5e11e9a19804b7a9c39e066,2024-04-14 05:22:53,2024-04-17 05:22:53,f9b68e87f65148f08a184498,0,3,5,4,Ahead develop consider should only push.
DE-078,completed,d5e11e9a19804b7a9c39e066,2024-04-14 05:22:53,2024-04-17 05:22:53,147b17d3fefe4b72ab792ac5,3,0,6,8,Experience draw firm both.
DE-078,completed,d5e11e9a19804b7a9c39e066,2024-04-14 05:22:53,2024-04-17 05:22:53,bd720776c35d40b98d91d1da,9,7,3,5,Day finish something usually administration body.
DE-078,completed,d5e11e9a19804b7a9c39e066,2024-04-14 05:22:53,2024-04-17 05:22:53,047793b0ec444e07921e5125,9,7,9,10,Easy agent ten consumer.
DE-078,completed,d5e11e9a19804b7a9c39e066,2024-04-14 05:22:53,2024-04-17 05:22:53,cbb45c9e867f407c95e86656,9,1,2,7,Investment wonder drug assume nearly certainly.
DE-078,completed,d5e11e9a19804b7a9c39e066,2024-04-14 05:22:53,2024-04-17 05:22:53,7a54970c35fa499ca4d2aaf4,3,1,10,4,Voice direction pressure Congress.
DE-078,completed,d5e11e9a19804b7a9c39e066,2024-04-14 05:22:53,2024-04-17 05:22:53,f024b28d08de4db5b34731cd,4,10,8,10,Imagine entire every play song.
DE-078,completed,d5e11e9a19804b7a9c39e066,2024-04-14 05:22:53,2024-04-17 05:22:53,2d3e6ec06657428aaba917b4,0,1,5,2,Rule wear remain exist wide try.
DE-078,completed,d5e11e9a19804b7a9c39e066,2024-04-14 05:22:53,2024-04-17 05:22:53,cd4a77c4901248109e627418,4,4,6,10,To whom stand once apply cost.
DE-078,completed,d5e11e9a19804b7a9c39e066,2024-04-14 05:22:53,2024-04-17 05:22:53,2278f30f19884694bc442320,3,7,7,3,Really or almost upon wind this former finally.
DE-078,completed,d5e11e9a19804b7a9c39e066,2024-04-14 05:22:53,2024-04-17 05:22:53,821cb9a6ce9841d3bce920a9,2,8,1,7,At air ever.
DE-078,completed,d5e11e9a19804b7a9c39e066,2024-04-14 05:22:53,2024-04-17 05:22:53,5674b309cb524c7d9e9d38ad,7,5,1,5,Thought also lot southern four whatever.
DE-078,completed,d5e11e9a19804b7a9c39e066,2024-04-14 05:22:53,2024-04-17 05:22:53,7436622c505043e386dc6b92,0,1,7,8,Still charge available interest.
DE-078,completed,d5e11e9a19804b7a9c39e066,2024-04-14 05:22:53,2024-04-17 05:22:53,5960657de40c4a1e8cb5f4fb,7,7,7,2,Always itself green authority policy.
DE-078,completed,d5e11e9a19804b7a9c39e066,2024-04-14 05:22:53,2024-04-17 05:22:53,f12ece20b0004c929841d4bc,1,2,7,3,Again mean woman already force network factor.
DE-078,completed,d5e11e9a19804b7a9c39e066,2024-04-14 05:22:53,2024-04-17 05:22:53,34bc69eeebdc490d83539e8d,3,5,1,5,Place sign lose conference within.
DE-078,completed,d5e11e9a19804b7a9c39e066,2024-04-14 05:22:53,2024-04-17 05:22:53,6d780db54de94b418d7c1ed4,10,2,8,9,Mouth station seat mother crime story.
ST-079,ongoing,2db65cdffea74fe2bc7b7acd,2024-06-22 01:19:57,2024-07-17 01:19:57,32f553e104854cc080ee81ad,2,0,9,2,Current build case back writer forward.
ST-079,ongoing,2db65cdffea74fe2bc7b7acd,2024-06-22 01:19:57,2024-07-17 01:19:57,0490ffba73994d7ba11470c1,5,4,2,0,National leader several memory young.
ST-079,ongoing,2db65cdffea74fe2bc7b7acd,2024-06-22 01:19:57,2024-07-17 01:19:57,2308af8dee654be280fae109,10,0,4,5,These moment week later give.
ST-079,ongoing,2db65cdffea74fe2bc7b7acd,2024-06-22 01:19:57,2024-07-17 01:19:57,64818f853e134a56aa988f9d,6,7,7,7,Move see lose break.
ST-079,ongoing,2db65cdffea74fe2bc7b7acd,2024-06-22 01:19:57,2024-07-17 01:19:57,fe286f3e77ff4c8381e3ecb8,2,2,10,4,Daughter page dinner man especially.
ST-079,ongoing,2db65cdffea74fe2bc7b7acd,2024-06-22 01:19:57,2024-07-17 01:19:57,97b55ee694124eed85da2706,10,5,4,5,Tend key while next structure.
ST-079,ongoing,2db65cdffea74fe2bc7b7acd,2024-06-22 01:19:57,2024-07-17 01:19:57,ac18e06f43ef40fbb60661f0,7,2,2,1,Respond management kitchen design.
ST-079,ongoing,2db65cdffea74fe2bc7b7acd,2024-06-22 01:19:57,2024-07-17 01:19:57,b39557b0c5674d0784922348,8,8,0,6,Plan choice trouble war population fall.
ST-079,ongoing,2db65cdffea74fe2bc7b7acd,2024-06-22 01:19:57,2024-07-17 01:19:57,5e3ca27d71df4ed6a5fbc552,5,5,10,8,Rich knowledge manager score put true card sense.
ST-079,ongoing,2db65cdffea74fe2bc7b7acd,2024-06-22 01:19:57,2024-07-17 01:19:57,92534335c6f64aca98247634,2,9,4,7,Woman hundred everybody force guess.
ST-079,ongoing,2db65cdffea74fe2bc7b7acd,2024-06-22 01:19:57,2024-07-17 01:19:57,1e1cba4d2e1a491190e4f4b1,3,6,5,1,Live heavy very apply style serious.
ST-079,ongoing,2db65cdffea74fe2bc7b7acd,2024-06-22 01:19:57,2024-07-17 01:19:57,d354e214822e40d8bbc6a6d4,10,9,5,6,Or health way leave head while.
ST-079,ongoing,2db65cdffea74fe2bc7b7acd,2024-06-22 01:19:57,2024-07-17 01:19:57,14491ab8163f4f69ab5a7a69,4,5,2,10,Blue rather for paper fire.
ST-079,ongoing,2db65cdffea74fe2bc7b7acd,2024-06-22 01:19:57,2024-07-17 01:19:57,d07ffbfd60674eef8089783f,1,8,5,5,Own seek experience series fire hair old.
ST-079,ongoing,2db65cdffea74fe2bc7b7acd,2024-06-22 01:19:57,2024-07-17 01:19:57,f1c800b0ee344ffc98d8d03d,9,5,6,6,Can experience strategy around thousand second party.
ST-079,ongoing,2db65cdffea74fe2bc7b7acd,2024-06-22 01:19:57,2024-07-17 01:19:57,478b67741b9149e6aba01c32,3,3,2,6,Five however agency threat change just first.
ST-079,ongoing,2db65cdffea74fe2bc7b7acd,2024-06-22 01:19:57,2024-07-17 01:19:57,ede31c80677746658fc63ff5,10,7,7,2,Someone three institution baby.
DS-080,completed,071935ceada34f99a38cd496,2024-04-15 05:10:27,2024-04-20 05:10:27,64c82828879745ca91dbadb1,3,10,5,9,Everybody old air.
DS-080,completed,071935ceada34f99a38cd496,2024-04-15 05:10:27,2024-04-20 05:10:27,0f3dd94a7c7046589aa5fa0a,1,0,2,4,Evening system way recent position turn interest.
DS-080,completed,071935ceada34f99a38cd496,2024-04-15 05:10:27,2024-04-20 05:10:27,ac38af203e7c4ae99631ccad,3,3,3,8,Push arm ready federal.
DS-080,completed,071935ceada34f99a38cd496,2024-04-15 05:10:27,2024-04-20 05:10:27,c468c4b2537f4dd2b3dc0018,5,8,7,9,Assume hundred new artist involve traditional.
DS-080,completed,071935ceada34f99a38cd496,2024-04-15 05:10:27,2024-04-20 05:10:27,17e5f4f0e72349a5913e564b,0,6,6,1,Book seven discussion tonight once next military.
DS-080,completed,071935ceada34f99a38cd496,2024-04-15 05:10:27,2024-04-20 05:10:27,eabbe67d2bac440282d38e6d,6,2,1,8,Together result seek part fill.
DS-080,completed,071935ceada34f99a38cd496,2024-04-15 05:10:27,2024-04-20 05:10:27,55d951dce3c04eb6b047f94b,5,0,7,4,Us second near total.
DS-080,completed,071935ceada34f99a38cd496,2024-04-15 05:10:27,2024-04-20 05:10:27,14ef4aa40d8c49ccac0ece91,8,5,10,6,Truth stage prevent cover worry money.
DS-080,completed,071935ceada34f99a38cd496,2024-04-15 05:10:27,2024-04-20 05:10:27,899c0f9394c8410cb67eabd1,4,2,9,6,Own item whom car politics first development.
DS-080,completed,071935ceada34f99a38cd496,2024-04-15 05:10:27,2024-04-20 05:10:27,fec6ac2c64b344f7b5630cda,8,9,3,5,Range because put behind some action figure.
DS-080,completed,071935ceada34f99a38cd496,2024-04-15 05:10:27,2024-04-20 05:10:27,9ed6b58bd1724e37a786a78a,9,9,2,8,Appear rate almost factor.
DS-080,completed,071935ceada34f99a38cd496,2024-04-15 05:10:27,2024-04-20 05:10:27,eca088db92db43e582cd3dfc,4,4,10,8,Watch factor traditional probably.
DS-080,completed,071935ceada34f99a38cd496,2024-04-15 05:10:27,2024-04-20 05:10:27,a99352dd1032486bb7bdac21,2,4,0,9,Night figure his character.
DS-080,completed,071935ceada34f99a38cd496,2024-04-15 05:10:27,2024-04-20 05:10:27,b4d40e1e1bb44a868105edd6,7,9,2,4,Add hour produce although message.
DS-080,completed,071935ceada34f99a38cd496,2024-04-15 05:10:27,2024-04-20 05:10:27,bd720776c35d40b98d91d1da,4,9,10,9,Lay executive her various matter quality.
DS-080,completed,071935ceada34f99a38cd496,2024-04-15 05:10:27,2024-04-20 05:10:27,05d402c73bcd4ebf96b85f03,7,4,2,9,Full yes same coach federal difference data good.
DS-080,completed,071935ceada34f99a38cd496,2024-04-15 05:10:27,2024-04-20 05:10:27,501af38427864cff90eeb553,6,2,9,7,Area into join dinner space.
FS-081,completed,b36bcb69ee624187aad3de08,2024-07-28 00:31:44,2024-08-12 00:31:44,06685d5ec2fc47de9ae0f24d,9,2,5,4,Degree point particular source.
FS-081,completed,b36bcb69ee624187aad3de08,2024-07-28 00:31:44,2024-08-12 00:31:44,5960657de40c4a1e8cb5f4fb,5,3,6,9,Safe avoid would force live.
FS-081,completed,b36bcb69ee624187aad3de08,2024-07-28 00:31:44,2024-08-12 00:31:44,f3afcbee49f5415c9ad12151,1,8,4,2,Church church knowledge interest.
FS-081,completed,b36bcb69ee624187aad3de08,2024-07-28 00:31:44,2024-08-12 00:31:44,bd720776c35d40b98d91d1da,1,0,1,1,Create exactly police fall effort above serve market.
FS-081,completed,b36bcb69ee624187aad3de08,2024-07-28 00:31:44,2024-08-12 00:31:44,c0e6e981109242adb11fd7c1,6,2,10,2,Open woman discuss half.
FS-081,completed,b36bcb69ee624187aad3de08,2024-07-28 00:31:44,2024-08-12 00:31:44,a70b4e352b594fa2b9779504,6,10,4,4,Television you position wide special.
FS-081,completed,b36bcb69ee624187aad3de08,2024-07-28 00:31:44,2024-08-12 00:31:44,c69025525f3341f9a7ef23db,3,6,6,3,Different yet base prepare article.
FS-081,completed,b36bcb69ee624187aad3de08,2024-07-28 00:31:44,2024-08-12 00:31:44,504ad7c72f2143c79444aaea,7,7,6,9,Painting number avoid over oil.
FS-081,completed,b36bcb69ee624187aad3de08,2024-07-28 00:31:44,2024-08-12 00:31:44,cd4a77c4901248109e627418,3,4,9,3,Race police step build.
FS-081,completed,b36bcb69ee624187aad3de08,2024-07-28 00:31:44,2024-08-12 00:31:44,df27b970451949b0a5474ad0,3,4,6,7,Next five generation should yet.
FS-081,completed,b36bcb69ee624187aad3de08,2024-07-28 00:31:44,2024-08-12 00:31:44,dee86a0d172f44dc8fda0f0c,9,6,6,9,National issue bank necessary.
FS-081,completed,b36bcb69ee624187aad3de08,2024-07-28 00:31:44,2024-08-12 00:31:44,25133e6898c6468fb0a710b8,6,4,1,1,Spend agency parent term.
FS-081,completed,b36bcb69ee624187aad3de08,2024-07-28 00:31:44,2024-08-12 00:31:44,958c6371cdcb4b7eb0a91e6d,2,4,2,7,Catch race south include him cup practice show.
FS-081,completed,b36bcb69ee624187aad3de08,2024-07-28 00:31:44,2024-08-12 00:31:44,686bae5495ff4a8886c4feb5,5,4,3,6,Help approach read whole purpose.
FS-081,completed,b36bcb69ee624187aad3de08,2024-07-28 00:31:44,2024-08-12 00:31:44,6dd7b2f7ec5046d39f09b886,9,5,1,4,Relationship ago step practice manager yeah collection.
FS-081,completed,b36bcb69ee624187aad3de08,2024-07-28 00:31:44,2024-08-12 00:31:44,89bfe9a0c3954deb97776cc2,9,7,6,9,Main ten explain popular against down.
FS-081,completed,b36bcb69ee624187aad3de08,2024-07-28 00:31:44,2024-08-12 00:31:44,d354e214822e40d8bbc6a6d4,2,6,6,3,Common threat whether site right art.
UI-082,pending,e6c0204eb1ed4d019bb15192,2024-01-13 21:38:01,2024-01-25 21:38:01,f4b9a914639c410b92cca27d,6,5,7,2,Over relationship risk rate large.
UI-082,pending,e6c0204eb1ed4d019bb15192,2024-01-13 21:38:01,2024-01-25 21:38:01,6e13923e48184a9b94ba0b6c,2,4,1,6,Nature recent customer feeling receive.
UI-082,pending,e6c0204eb1ed4d019bb15192,2024-01-13 21:38:01,2024-01-25 21:38:01,1643aebfe7ce48d49e06b41f,2,2,3,9,Mouth situation law serious face.
UI-082,pending,e6c0204eb1ed4d019bb15192,2024-01-13 21:38:01,2024-01-25 21:38:01,357dd7b0fb94466baad07940,5,6,6,4,Event soon we building language.
UI-082,pending,e6c0204eb1ed4d019bb15192,2024-01-13 21:38:01,2024-01-25 21:38:01,1973cec5eea7468ab58f9fb1,1,9,7,9,Fight indicate key write protect identify again yet.
UI-082,pending,e6c0204eb1ed4d019bb15192,2024-01-13 21:38:01,2024-01-25 21:38:01,a4d6dec5c2844c658a12bdea,1,2,10,0,Indicate seem statement city.
UI-082,pending,e6c0204eb1ed4d019bb15192,2024-01-13 21:38:01,2024-01-25 21:38:01,c9e0b5faf1e24805a8acf28f,7,5,7,6,Factor tree me quite high son.
UI-082,pending,e6c0204eb1ed4d019bb15192,2024-01-13 21:38:01,2024-01-25 21:38:01,978a4c48d6574c4fb9877a26,4,9,2,6,Shoulder item deep plant need investment must store.
UI-082,pending,e6c0204eb1ed4d019bb15192,2024-01-13 21:38:01,2024-01-25 21:38:01,72fadead725e49db90e20ad6,8,3,4,3,Record expect often one five Mrs building.
UI-082,pending,e6c0204eb1ed4d019bb15192,2024-01-13 21:38:01,2024-01-25 21:38:01,690a46efc18a447d97dc9f9a,6,3,7,9,Ready everybody teacher budget about modern.
UI-082,pending,e6c0204eb1ed4d019bb15192,2024-01-13 21:38:01,2024-01-25 21:38:01,8312fd8d3bfa4e9aa3c092af,9,5,4,9,Society sea ten bill star significant almost.
UI-082,pending,e6c0204eb1ed4d019bb15192,2024-01-13 21:38:01,2024-01-25 21:38:01,c9cba9f1107545f094cd96f2,4,8,5,4,Affect activity cup discuss.
UI-082,pending,e6c0204eb1ed4d019bb15192,2024-01-13 21:38:01,2024-01-25 21:38:01,f2b25fe2cbef4a9098df36d7,1,3,1,6,Treat fund service hotel.
UI-082,pending,e6c0204eb1ed4d019bb15192,2024-01-13 21:38:01,2024-01-25 21:38:01,368525625ad64d358f3c2f1f,2,7,4,1,Interest turn low home ability enjoy.
UI-082,pending,e6c0204eb1ed4d019bb15192,2024-01-13 21:38:01,2024-01-25 21:38:01,e941b02bdc0f465f8df1f4a9,2,1,5,7,Represent upon organization wide.
UI-082,pending,e6c0204eb1ed4d019bb15192,2024-01-13 21:38:01,2024-01-25 21:38:01,79c7df1d030f4a4dae77e9f9,5,4,1,4,Sport break difficult simply positive child.
UI-082,pending,e6c0204eb1ed4d019bb15192,2024-01-13 21:38:01,2024-01-25 21:38:01,8fe7b9739b8a4b30b3d51dda,5,1,4,5,Culture happen bad.
UI-082,pending,e6c0204eb1ed4d019bb15192,2024-01-13 21:38:01,2024-01-25 21:38:01,b5148c0348ce4464b6f9aed1,5,6,3,8,Enjoy police listen do rather.
UI-082,pending,e6c0204eb1ed4d019bb15192,2024-01-13 21:38:01,2024-01-25 21:38:01,73c8f39118a14138aad5c955,7,6,10,8,Former writer image close least Mrs.
UI-082,pending,e6c0204eb1ed4d019bb15192,2024-01-13 21:38:01,2024-01-25 21:38:01,02a2d0a8e45d4481822d505e,9,9,7,7,Wind garden close wall nor management.
UI-082,pending,e6c0204eb1ed4d019bb15192,2024-01-13 21:38:01,2024-01-25 21:38:01,bc76fb61a4444e25aee66e5d,3,3,6,9,Per between find be market add gas.
UI-082,pending,e6c0204eb1ed4d019bb15192,2024-01-13 21:38:01,2024-01-25 21:38:01,aa231520bb554c3f9a0c4655,9,2,6,9,Deep start establish Mrs answer behavior sell.
DS-083,ongoing,b66f717cf73e4477b3dcca56,2024-03-01 09:21:06,2024-03-06 09:21:06,dd0488ef0bcd4226b20ce812,3,7,3,6,Property campaign me at sometimes fire.
DS-083,ongoing,b66f717cf73e4477b3dcca56,2024-03-01 09:21:06,2024-03-06 09:21:06,0a9ce8b937694019b59d06ea,5,9,1,5,Rule material the.
DS-083,ongoing,b66f717cf73e4477b3dcca56,2024-03-01 09:21:06,2024-03-06 09:21:06,98ed60123dc04f50b81575a2,4,0,2,3,Place read per should start play.
DS-083,ongoing,b66f717cf73e4477b3dcca56,2024-03-01 09:21:06,2024-03-06 09:21:06,5ff1d6bb7f2c457fbd00615e,7,6,2,10,Democrat add degree here moment artist give.
DS-083,ongoing,b66f717cf73e4477b3dcca56,2024-03-01 09:21:06,2024-03-06 09:21:06,6fafe77b62fc4ae5895ee135,2,3,1,9,Rise morning have edge door college plant.
DS-083,ongoing,b66f717cf73e4477b3dcca56,2024-03-01 09:21:06,2024-03-06 09:21:06,2a0da867a2484ffe903a9531,3,1,2,9,But similar community.
DS-083,ongoing,b66f717cf73e4477b3dcca56,2024-03-01 09:21:06,2024-03-06 09:21:06,c2eaf7fa8bb546fd999e46d5,2,2,3,8,Education be fire large task rest trouble campaign.
DS-083,ongoing,b66f717cf73e4477b3dcca56,2024-03-01 09:21:06,2024-03-06 09:21:06,003c14fab95048dfa5f8e200,1,1,5,2,Commercial federal but now to wonder.
DS-083,ongoing,b66f717cf73e4477b3dcca56,2024-03-01 09:21:06,2024-03-06 09:21:06,35bd3b7cd8e349a8bedc8ca0,1,4,9,10,Check explain thank tree entire.
DS-083,ongoing,b66f717cf73e4477b3dcca56,2024-03-01 09:21:06,2024-03-06 09:21:06,982c1b3fefcd47e5bb3518f8,0,4,7,4,Increase Republican team pattern get into fly wish.
DS-083,ongoing,b66f717cf73e4477b3dcca56,2024-03-01 09:21:06,2024-03-06 09:21:06,5f50197b93214b63ad794314,5,5,7,5,Say successful how.
