training_code,status,trainer,startDate,endDate,participant_user,participant_hackerRankScore,participant_assessmentScore,participant_performance,participant_communication,participant_remarks
DE-042,ongoing,399f26ed5a134775914a17b6,2024-01-10 00:21:47,2024-02-06 00:21:47,1973cec5eea7468ab58f9fb1,5,7,4,2,Property south center across million section that choose.
DE-042,ongoing,399f26ed5a134775914a17b6,2024-01-10 00:21:47,2024-02-06 00:21:47,094d662dbb0046ceb22f49de,6,9,1,2,Thing attack support stock relationship religious entire.
DE-042,ongoing,399f26ed5a134775914a17b6,2024-01-10 00:21:47,2024-02-06 00:21:47,ed03026bbeed4f85bcac706f,3,3,3,7,Yourself letter everyone dinner first form.
DE-042,ongoing,399f26ed5a134775914a17b6,2024-01-10 00:21:47,2024-02-06 00:21:47,c2cc2fa3797a4a9c9a3a47b0,8,6,6,6,Especially agent my hard popular stay large.
DE-042,ongoing,399f26ed5a134775914a17b6,2024-01-10 00:21:47,2024-02-06 00:21:47,fb3bf0ef26714285b0486853,2,1,2,10,Do street somebody if many coach.
DE-042,ongoing,399f26ed5a134775914a17b6,2024-01-10 00:21:47,2024-02-06 00:21:47,eb2bd783b67240d0a731d401,6,2,1,7,About gun buy.
DE-042,ongoing,399f26ed5a134775914a17b6,2024-01-10 00:21:47,2024-02-06 00:21:47,f918026b463545bc81513eb2,6,3,7,5,Run name kid central project adult.
DE-042,ongoing,399f26ed5a134775914a17b6,2024-01-10 00:21:47,2024-02-06 00:21:47,03ac916a4c284c0e91b68bd2,5,9,5,4,Likely particularly bad between seek quite.
DE-042,ongoing,399f26ed5a134775914a17b6,2024-01-10 00:21:47,2024-02-06 00:21:47,aa231520bb554c3f9a0c4655,7,7,2,9,Fact movie future similar least machine.
DE-042,ongoing,399f26ed5a134775914a17b6,2024-01-10 00:21:47,2024-02-06 00:21:47,1c4a4d0f76cf45978cd30e1d,0,7,8,2,Hundred plan message father science bank.
DE-042,ongoing,399f26ed5a134775914a17b6,2024-01-10 00:21:47,2024-02-06 00:21:47,49fd1b5b32c94d0284920c41,2,8,2,4,Common anyone effect keep.
DE-042,ongoing,399f26ed5a134775914a17b6,2024-01-10 00:21:47,2024-02-06 00:21:47,99437633f11541d5b78e41cb,2,6,3,9,Account surface data brother imagine difference another.
DE-042,ongoing,399f26ed5a134775914a17b6,2024-01-10 00:21:47,2024-02-06 00:21:47,0564250bed8d43e1839f0cc1,6,8,10,5,Any clear establish yes.
DE-042,ongoing,399f26ed5a134775914a17b6,2024-01-10 00:21:47,2024-02-06 00:21:47,88c89315fdb643a69c15e145,3,7,3,2,Hope office director enough ahead fire.
DE-042,ongoing,399f26ed5a134775914a17b6,2024-01-10 00:21:47,2024-02-06 00:21:47,71abf80f17054d61ab837157,8,8,9,0,Until during relationship begin.
DE-042,ongoing,399f26ed5a134775914a17b6,2024-01-10 00:21:47,2024-02-06 00:21:47,8f220ac3d52a47029203236d,2,1,0,7,New research agent accept.
DE-042,ongoing,399f26ed5a134775914a17b6,2024-01-10 00:21:47,2024-02-06 00:21:47,7feced3090d44e84afffb6e8,6,6,1,9,Several painting number maybe.
DE-042,ongoing,399f26ed5a134775914a17b6,2024-01-10 00:21:47,2024-02-06 00:21:47,df0706e6572d4f699543426f,0,5,0,7,Although meeting certainly necessary direction.
DE-042,ongoing,399f26ed5a134775914a17b6,2024-01-10 00:21:47,2024-02-06 00:21:47,cb8d5f5cae3d4218918e738d,6,2,5,2,Support agree beautiful government too specific.
DE-042,ongoing,399f26ed5a134775914a17b6,2024-01-10 00:21:47,2024-02-06 00:21:47,8ac03c318d7240afa3fa757e,5,2,9,2,Business cover your huge.
ST-043,ongoing,aebcb1c0f2d3423c9eddcdcb,2024-06-20 20:18:46,2024-07-15 20:18:46,36895ec3744d4adb97854290,0,3,7,7,Crime subject design camera fund should.
ST-043,ongoing,aebcb1c0f2d3423c9eddcdcb,2024-06-20 20:18:46,2024-07-15 20:18:46,3dcf011f891a45bc83981b8d,3,4,1,8,Determine your popular total agent.
ST-043,ongoing,aebcb1c0f2d3423c9eddcdcb,2024-06-20 20:18:46,2024-07-15 20:18:46,6ba567d2a3f74691b77e5dae,4,1,6,9,Rise player office summer heavy black especially.
ST-043,ongoing,aebcb1c0f2d3423c9eddcdcb,2024-06-20 20:18:46,2024-07-15 20:18:46,c8e9a796448d4340892de589,3,5,4,7,Great say huge machine in cut enjoy.
ST-043,ongoing,aebcb1c0f2d3423c9eddcdcb,2024-06-20 20:18:46,2024-07-15 20:18:46,5a7d90b02b514d128557535e,5,7,5,9,Development cover matter wonder fish sell senior truth.
ST-043,ongoing,aebcb1c0f2d3423c9eddcdcb,2024-06-20 20:18:46,2024-07-15 20:18:46,9baf4d58b93e452e9bd7766f,2,2,4,1,Data fish simple including fund painting PM.
ST-043,ongoing,aebcb1c0f2d3423c9eddcdcb,2024-06-20 20:18:46,2024-07-15 20:18:46,cd4a77c4901248109e627418,2,3,8,5,Agree her Congress friend public.
DS-044,ongoing,48539a7d30ad400da869a9dc,2024-05-23 13:56:08,2024-05-28 13:56:08,478b67741b9149e6aba01c32,5,10,9,5,Girl development hold our.
DS-044,ongoing,48539a7d30ad400da869a9dc,2024-05-23 13:56:08,2024-05-28 13:56:08,f12ece20b0004c929841d4bc,10,4,8,1,Family who yard vote cover.
DS-044,ongoing,48539a7d30ad400da869a9dc,2024-05-23 13:56:08,2024-05-28 13:56:08,9ed6b58bd1724e37a786a78a,4,9,6,1,Phone teach detail do eye.
DS-044,ongoing,48539a7d30ad400da869a9dc,2024-05-23 13:56:08,2024-05-28 13:56:08,1ebae459f5c44aa8a0c5b1c4,4,9,8,2,Surface learn box pattern kitchen reach next.
DS-044,ongoing,48539a7d30ad400da869a9dc,2024-05-23 13:56:08,2024-05-28 13:56:08,224b32bd7ec64ca989d3476f,0,4,8,10,Matter card outside for chair help crime.
DS-044,ongoing,48539a7d30ad400da869a9dc,2024-05-23 13:56:08,2024-05-28 13:56:08,4e1cad23a2bb4ce691b585ca,4,1,0,5,Way society wonder heavy hear ago two store.
DS-044,ongoing,48539a7d30ad400da869a9dc,2024-05-23 13:56:08,2024-05-28 13:56:08,ed03026bbeed4f85bcac706f,2,5,4,4,Inside decision arm Mr program name positive we.
DS-044,ongoing,48539a7d30ad400da869a9dc,2024-05-23 13:56:08,2024-05-28 13:56:08,e9eab59152134be6862ff8d9,6,5,5,0,Democrat list miss senior.
DS-044,ongoing,48539a7d30ad400da869a9dc,2024-05-23 13:56:08,2024-05-28 13:56:08,d0f93447ea854215bd750ff9,7,6,2,4,Hit along beautiful similar need.
DS-044,ongoing,48539a7d30ad400da869a9dc,2024-05-23 13:56:08,2024-05-28 13:56:08,1a309a1d0514444b91d9e110,3,6,7,6,Course make you hit war.
DS-044,ongoing,48539a7d30ad400da869a9dc,2024-05-23 13:56:08,2024-05-28 13:56:08,0e8974c27f9c4bc481a49b68,7,1,6,7,Sport down audience behind cost.
DS-044,ongoing,48539a7d30ad400da869a9dc,2024-05-23 13:56:08,2024-05-28 13:56:08,4416d0c2da7c499e94ee4644,4,6,2,0,Kind different large stuff.
DS-044,ongoing,48539a7d30ad400da869a9dc,2024-05-23 13:56:08,2024-05-28 13:56:08,f9ef3510e08d459b83e37082,4,8,1,6,Hand between bad.
DS-044,ongoing,48539a7d30ad400da869a9dc,2024-05-23 13:56:08,2024-05-28 13:56:08,0e729793876c42d38ab5c374,5,9,10,3,Tonight plan mind conference kitchen lay onto.
DS-044,ongoing,48539a7d30ad400da869a9dc,2024-05-23 13:56:08,2024-05-28 13:56:08,17e5f4f0e72349a5913e564b,7,0,4,3,We picture final push by design write.
DS-044,ongoing,48539a7d30ad400da869a9dc,2024-05-23 13:56:08,2024-05-28 13:56:08,b78c640a9473403a9441a35f,6,2,3,4,Set change star prevent source.
FS-045,completed,75e68fbcd1cf42a99dbc7b0e,2024-06-03 22:17:33,2024-06-11 22:17:33,e636d6c5b0854088b02e5c1c,5,2,8,2,Medical might color sea hard.
FS-045,completed,75e68fbcd1cf42a99dbc7b0e,2024-06-03 22:17:33,2024-06-11 22:17:33,c51a33a2ade242de9f2bb39b,4,7,4,0,Different rather example office table.
FS-045,completed,75e68fbcd1cf42a99dbc7b0e,2024-06-03 22:17:33,2024-06-11 22:17:33,583009360661466394e80055,7,8,3,9,Now whom girl build hair.
FS-045,completed,75e68fbcd1cf42a99dbc7b0e,2024-06-03 22:17:33,2024-06-11 22:17:33,13991062ca0f44fa8aca3206,4,2,4,9,Include behavior vote amount section door mouth.
FS-045,completed,75e68fbcd1cf42a99dbc7b0e,2024-06-03 22:17:33,2024-06-11 22:17:33,56ff2b3d24054598bfbc614c,5,9,7,3,Type her floor name manager recognize.
FS-045,completed,75e68fbcd1cf42a99dbc7b0e,2024-06-03 22:17:33,2024-06-11 22:17:33,d3e040b72dcc4f7abc8e981e,6,6,2,8,Traditional friend page production stand.
FS-045,completed,75e68fbcd1cf42a99dbc7b0e,2024-06-03 22:17:33,2024-06-11 22:17:33,d8e086b485644c25a7dab207,7,6,3,4,Public tax shake job produce case city.
FS-045,completed,75e68fbcd1cf42a99dbc7b0e,2024-06-03 22:17:33,2024-06-11 22:17:33,738c5d376f1e44ee915f9c30,5,7,10,3,Somebody force three station.
FS-045,completed,75e68fbcd1cf42a99dbc7b0e,2024-06-03 22:17:33,2024-06-11 22:17:33,e548a2fc6faa4b5eb4fd4edf,1,5,7,1,Rate response question natural defense.
FS-045,completed,75e68fbcd1cf42a99dbc7b0e,2024-06-03 22:17:33,2024-06-11 22:17:33,452a71136ccb457485a584ec,4,1,8,10,Somebody only because south.
FS-045,completed,75e68fbcd1cf42a99dbc7b0e,2024-06-03 22:17:33,2024-06-11 22:17:33,f43292da42264ee6964f634e,3,9,4,3,Expect beat word report experience culture director sound.
FS-045,completed,75e68fbcd1cf42a99dbc7b0e,2024-06-03 22:17:33,2024-06-11 22:17:33,5622bac22e054c859b83cced,10,5,1,9,Heavy picture subject campaign girl.
FS-045,completed,75e68fbcd1cf42a99dbc7b0e,2024-06-03 22:17:33,2024-06-11 22:17:33,4085a81f47dc4ba9a7735d4e,1,1,1,3,Test once thank house machine magazine language.
FS-045,completed,75e68fbcd1cf42a99dbc7b0e,2024-06-03 22:17:33,2024-06-11 22:17:33,1b994fc8e1a941b49e002c42,5,7,2,0,Blue him program beyond message democratic now.
DE-046,pending,3d4ba953d7a747fda92c5644,2024-01-07 02:07:08,2024-02-02 02:07:08,7da88d283b1d4b94b6a56380,1,9,3,6,Pass main you model tend report defense side.
DE-046,pending,3d4ba953d7a747fda92c5644,2024-01-07 02:07:08,2024-02-02 02:07:08,9476141ca1cf4a5fbbac5127,3,7,9,5,Form past throw agent evening.
DE-046,pending,3d4ba953d7a747fda92c5644,2024-01-07 02:07:08,2024-02-02 02:07:08,d8a5d7f9fc464982887c4af4,7,6,7,7,Shoulder return during party choice important condition.
DE-046,pending,3d4ba953d7a747fda92c5644,2024-01-07 02:07:08,2024-02-02 02:07:08,9f9aa24710764329bae3aae3,6,4,4,2,Decide president account.
DE-046,pending,3d4ba953d7a747fda92c5644,2024-01-07 02:07:08,2024-02-02 02:07:08,b0aeca492e9f4138ae883cfa,10,9,3,6,You attack name decade.
DE-046,pending,3d4ba953d7a747fda92c5644,2024-01-07 02:07:08,2024-02-02 02:07:08,025b3367d3f34d92b4566132,4,10,10,4,Reason adult imagine recent.
DE-046,pending,3d4ba953d7a747fda92c5644,2024-01-07 02:07:08,2024-02-02 02:07:08,6ba567d2a3f74691b77e5dae,5,5,7,8,Customer mission sure recent road car from.
FS-047,pending,9a0d9af92c874f01be9f98e6,2024-06-08 23:14:41,2024-06-25 23:14:41,14ef4aa40d8c49ccac0ece91,6,4,2,7,Shoulder however beyond cultural Mrs social.
FS-047,pending,9a0d9af92c874f01be9f98e6,2024-06-08 23:14:41,2024-06-25 23:14:41,c468c4b2537f4dd2b3dc0018,9,4,6,2,Safe sometimes relate early different dream.
FS-047,pending,9a0d9af92c874f01be9f98e6,2024-06-08 23:14:41,2024-06-25 23:14:41,e7dac1b2cf064feb9fc51ca8,8,7,4,0,Financial beyond mean themselves.
FS-047,pending,9a0d9af92c874f01be9f98e6,2024-06-08 23:14:41,2024-06-25 23:14:41,75d360f64cce49ea8419f3d7,6,2,3,6,Arm stage interview street.
FS-047,pending,9a0d9af92c874f01be9f98e6,2024-06-08 23:14:41,2024-06-25 23:14:41,8f220ac3d52a47029203236d,10,5,1,6,Probably score hair painting.
FS-047,pending,9a0d9af92c874f01be9f98e6,2024-06-08 23:14:41,2024-06-25 23:14:41,74501cd2086a42ada9a72903,1,4,8,1,Third second purpose red.
FS-047,pending,9a0d9af92c874f01be9f98e6,2024-06-08 23:14:41,2024-06-25 23:14:41,0887f65e5d4c41638798884a,4,7,3,5,Line experience rest just charge choose.
FS-047,pending,9a0d9af92c874f01be9f98e6,2024-06-08 23:14:41,2024-06-25 23:14:41,f2144530891b48b092ac10fc,0,6,3,4,Because anyone author ahead ability order.
FS-047,pending,9a0d9af92c874f01be9f98e6,2024-06-08 23:14:41,2024-06-25 23:14:41,9f9aa24710764329bae3aae3,5,5,9,2,Agency concern or condition claim.
FS-047,pending,9a0d9af92c874f01be9f98e6,2024-06-08 23:14:41,2024-06-25 23:14:41,9bede043ea4248f298c10f55,3,9,1,3,Network should arm million.
FS-047,pending,9a0d9af92c874f01be9f98e6,2024-06-08 23:14:41,2024-06-25 23:14:41,2a2eefd57c9d472fb947d89a,1,5,7,10,Team try court doctor check value.
FS-047,pending,9a0d9af92c874f01be9f98e6,2024-06-08 23:14:41,2024-06-25 23:14:41,4ffb11bdabc149a5afe48d10,5,6,1,7,Campaign like certainly finish city what.
FS-047,pending,9a0d9af92c874f01be9f98e6,2024-06-08 23:14:41,2024-06-25 23:14:41,982c1b3fefcd47e5bb3518f8,3,3,6,0,Move employee foot or own about serve.
FS-047,pending,9a0d9af92c874f01be9f98e6,2024-06-08 23:14:41,2024-06-25 23:14:41,5c7e805cf15e4994a4481548,9,8,9,2,Admit sometimes movement people.
FS-047,pending,9a0d9af92c874f01be9f98e6,2024-06-08 23:14:41,2024-06-25 23:14:41,b0aeca492e9f4138ae883cfa,1,6,1,3,Meet business him child color most.
FS-047,pending,9a0d9af92c874f01be9f98e6,2024-06-08 23:14:41,2024-06-25 23:14:41,4af38438ee2d48789266d42b,9,8,10,4,Something box able daughter five example after.
FS-047,pending,9a0d9af92c874f01be9f98e6,2024-06-08 23:14:41,2024-06-25 23:14:41,fd937abdff1e4e7cb23a4d79,4,10,6,3,Movie not decide imagine check.
FS-047,pending,9a0d9af92c874f01be9f98e6,2024-06-08 23:14:41,2024-06-25 23:14:41,117c210006f946eda584566a,7,6,5,9,Work join standard population adult pressure bed.
FS-047,pending,9a0d9af92c874f01be9f98e6,2024-06-08 23:14:41,2024-06-25 23:14:41,2d3e6ec06657428aaba917b4,7,9,3,2,Fill explain owner whom never possible range.
FS-047,pending,9a0d9af92c874f01be9f98e6,2024-06-08 23:14:41,2024-06-25 23:14:41,24e7121c2d3145fcbf18a07f,4,3,6,4,Program right behind page process kid agent.
FS-047,pending,9a0d9af92c874f01be9f98e6,2024-06-08 23:14:41,2024-06-25 23:14:41,fa6864f48fa14965820b1df6,8,7,5,9,Claim any major can population positive hold would.
FS-048,pending,ed2d499b0b8042c89454a648,2024-04-15 02:56:48,2024-05-06 02:56:48,e26f3b2a1fdb45a7a9adf71e,4,4,0,6,Should writer hot work.
FS-048,pending,ed2d499b0b8042c89454a648,2024-04-15 02:56:48,2024-05-06 02:56:48,75c0eb864be444f9b9c72c27,5,4,6,8,Item focus team newspaper for word road.
FS-048,pending,ed2d499b0b8042c89454a648,2024-04-15 02:56:48,2024-05-06 02:56:48,c5659b5b2d614b978a4c3985,5,3,6,2,Staff teacher act prevent pattern war.
FS-048,pending,ed2d499b0b8042c89454a648,2024-04-15 02:56:48,2024-05-06 02:56:48,854ab9366a3f454dbfd99c9a,5,6,5,8,Loss room kind level charge ago.
FS-048,pending,ed2d499b0b8042c89454a648,2024-04-15 02:56:48,2024-05-06 02:56:48,1e1cba4d2e1a491190e4f4b1,8,6,3,7,Positive hospital within these scientist future many.
FS-048,pending,ed2d499b0b8042c89454a648,2024-04-15 02:56:48,2024-05-06 02:56:48,0598ed55b9ee40858939841d,8,2,1,0,Song arm just table.
FS-048,pending,ed2d499b0b8042c89454a648,2024-04-15 02:56:48,2024-05-06 02:56:48,45da28d740ed4c1b968b0a54,9,4,3,4,Possible enough let not ability.
ST-049,ongoing,5fc91943bf884fc58e500856,2024-08-21 17:00:09,2024-08-30 17:00:09,368525625ad64d358f3c2f1f,8,9,4,4,Eye three similar challenge green article campaign.
ST-049,ongoing,5fc91943bf884fc58e500856,2024-08-21 17:00:09,2024-08-30 17:00:09,8f6cf9c1949645adade49f69,8,7,0,0,Pretty new staff data manage what state.
ST-049,ongoing,5fc91943bf884fc58e500856,2024-08-21 17:00:09,2024-08-30 17:00:09,92534335c6f64aca98247634,3,6,7,7,Serve wear at Republican social receive tonight.
ST-049,ongoing,5fc91943bf884fc58e500856,2024-08-21 17:00:09,2024-08-30 17:00:09,500f32f16fd2440ebfe5442e,0,9,4,7,Responsibility figure true determine nation.
ST-049,ongoing,5fc91943bf884fc58e500856,2024-08-21 17:00:09,2024-08-30 17:00:09,1718566075aa48a7b337933d,8,3,4,4,Meeting none foreign face hard goal fish.
ST-049,ongoing,5fc91943bf884fc58e500856,2024-08-21 17:00:09,2024-08-30 17:00:09,1110b58497844a77b4d6b60b,6,9,1,5,Turn usually company PM its.
ST-049,ongoing,5fc91943bf884fc58e500856,2024-08-21 17:00:09,2024-08-30 17:00:09,07965216650a4d6092376136,8,8,8,5,Lose nothing push push.
ST-049,ongoing,5fc91943bf884fc58e500856,2024-08-21 17:00:09,2024-08-30 17:00:09,a9112a3d69e24d259db5f2f8,9,10,2,10,Speech thus camera including doctor seek.
ST-049,ongoing,5fc91943bf884fc58e500856,2024-08-21 17:00:09,2024-08-30 17:00:09,656c8586624a47b6bde48295,2,5,2,10,Out learn resource author section rich.
ST-049,ongoing,5fc91943bf884fc58e500856,2024-08-21 17:00:09,2024-08-30 17:00:09,b08a02f8a8c24786bcad30d3,2,4,0,6,Writer fine so control field second turn.
ST-049,ongoing,5fc91943bf884fc58e500856,2024-08-21 17:00:09,2024-08-30 17:00:09,437edd6ad9134047892c600a,5,6,3,1,Glass third hear company.
ST-049,ongoing,5fc91943bf884fc58e500856,2024-08-21 17:00:09,2024-08-30 17:00:09,97b55ee694124eed85da2706,4,7,1,3,Hair suddenly involve government service price other.
ST-049,ongoing,5fc91943bf884fc58e500856,2024-08-21 17:00:09,2024-08-30 17:00:09,dcda4af5d7724615a297cf86,8,1,4,3,Success probably authority newspaper leave of little bring.
DS-050,completed,686a12fcf24d4156a6c1cee8,2024-09-16 12:27:01,2024-10-10 12:27:01,f80cb8fa4f874a9798b42c33,7,6,6,1,One wonder boy food city.
DS-050,completed,686a12fcf24d4156a6c1cee8,2024-09-16 12:27:01,2024-10-10 12:27:01,4167d7feceea4b66a3f68b43,2,7,6,9,Return current join how use face strong.
DS-050,completed,686a12fcf24d4156a6c1cee8,2024-09-16 12:27:01,2024-10-10 12:27:01,f1ab22d2178c48588fd8e250,4,6,9,3,Increase effect white camera score do.
DS-050,completed,686a12fcf24d4156a6c1cee8,2024-09-16 12:27:01,2024-10-10 12:27:01,b0278ca8e7c14772bff035f9,6,5,2,5,Begin responsibility this pull.
DS-050,completed,686a12fcf24d4156a6c1cee8,2024-09-16 12:27:01,2024-10-10 12:27:01,7597e2a8269841498220379f,4,2,1,6,Shake civil though chair push.
DS-050,completed,686a12fcf24d4156a6c1cee8,2024-09-16 12:27:01,2024-10-10 12:27:01,d8e086b485644c25a7dab207,2,6,5,5,Plan class far break once kitchen customer.
DS-050,completed,686a12fcf24d4156a6c1cee8,2024-09-16 12:27:01,2024-10-10 12:27:01,42ad8606630a4e448e0f0919,2,2,4,8,Ten idea movie safe.
DS-050,completed,686a12fcf24d4156a6c1cee8,2024-09-16 12:27:01,2024-10-10 12:27:01,5ad6607496244a16a31f03e3,9,5,9,3,Fish key serious democratic performance middle also.
DS-050,completed,686a12fcf24d4156a6c1cee8,2024-09-16 12:27:01,2024-10-10 12:27:01,392018b4fdd4415eb9492208,7,7,10,4,Wait information station character accept response.
DS-050,completed,686a12fcf24d4156a6c1cee8,2024-09-16 12:27:01,2024-10-10 12:27:01,c6bf6a380e9145abaa62b112,3,0,1,4,Fish cup me explain sure always.
DS-050,completed,686a12fcf24d4156a6c1cee8,2024-09-16 12:27:01,2024-10-10 12:27:01,d71949a39d6c417192ecaf25,7,6,1,4,Opportunity morning author western green people.
DS-050,completed,686a12fcf24d4156a6c1cee8,2024-09-16 12:27:01,2024-10-10 12:27:01,478b67741b9149e6aba01c32,1,9,10,9,Management state student under.
DS-050,completed,686a12fcf24d4156a6c1cee8,2024-09-16 12:27:01,2024-10-10 12:27:01,68fb62b9fb954217934b5eae,6,5,2,1,Participant quite recent message.
DS-050,completed,686a12fcf24d4156a6c1cee8,2024-09-16 12:27:01,2024-10-10 12:27:01,87c756d6d6ac4039a49569b0,7,4,5,6,Cell sound provide lead.
DS-050,completed,686a12fcf24d4156a6c1cee8,2024-09-16 12:27:01,2024-10-10 12:27:01,8b5d501e9055406c8031e65c,3,6,2,2,Authority series happen on establish forget media.
DS-050,completed,686a12fcf24d4156a6c1cee8,2024-09-16 12:27:01,2024-10-10 12:27:01,83ab84eb88d44cd8b424f4ec,4,5,5,5,Accept total conference east necessary Mr year.
DS-051,ongoing,f901930ee242484b8df50053,2024-02-27 07:04:47,2024-03-10 07:04:47,0e729793876c42d38ab5c374,9,0,10,5,Level campaign where available ahead.
DS-051,ongoing,f901930ee242484b8df50053,2024-02-27 07:04:47,2024-03-10 07:04:47,4a12ff3ccb23450bac02b2fe,2,5,4,1,Billion campaign fish fast choose increase positive.
DS-051,ongoing,f901930ee242484b8df50053,2024-02-27 07:04:47,2024-03-10 07:04:47,085039cb87e74cb189deda89,6,4,1,3,Develop save white late doctor firm.
DS-051,ongoing,f901930ee242484b8df50053,2024-02-27 07:04:47,2024-03-10 07:04:47,b60a13eb5d5f4bde957db8f6,1,9,4,10,Follow true per college.
DS-051,ongoing,f901930ee242484b8df50053,2024-02-27 07:04:47,2024-03-10 07:04:47,17e5f4f0e72349a5913e564b,2,6,4,9,Responsibility maybe new back also.
DS-051,ongoing,f901930ee242484b8df50053,2024-02-27 07:04:47,2024-03-10 07:04:47,ede31c80677746658fc63ff5,4,3,5,3,Direction capital audience bag whom father raise.
DS-051,ongoing,f901930ee242484b8df50053,2024-02-27 07:04:47,2024-03-10 07:04:47,4af38438ee2d48789266d42b,4,3,8,10,Him everyone become feeling learn adult light.
DS-051,ongoing,f901930ee242484b8df50053,2024-02-27 07:04:47,2024-03-10 07:04:47,06952481e194496ca4d90a79,2,5,5,4,Recently participant partner trial together guy player.
DS-051,ongoing,f901930ee242484b8df50053,2024-02-27 07:04:47,2024-03-10 07:04:47,71e37dec79dd4e31ad18248a,5,8,1,6,Third peace back pay.
DS-051,ongoing,f901930ee242484b8df50053,2024-02-27 07:04:47,2024-03-10 07:04:47,cd4a77c4901248109e627418,3,10,4,1,Somebody two audience trial.
DS-051,ongoing,f901930ee242484b8df50053,2024-02-27 07:04:47,2024-03-10 07:04:47,04d513501f44423db13c72eb,2,0,10,0,Hand war foreign enjoy.
DS-051,ongoing,f901930ee242484b8df50053,2024-02-27 07:04:47,2024-03-10 07:04:47,731d672023294a9e96ac8cc5,4,4,6,6,Throughout third in before decade of small.
DS-051,ongoing,f901930ee242484b8df50053,2024-02-27 07:04:47,2024-03-10 07:04:47,8cd6c52d2ea0491ba16559cf,3,1,0,5,Send ask tax better TV short.
DS-051,ongoing,f901930ee242484b8df50053,2024-02-27 07:04:47,2024-03-10 07:04:47,504ad7c72f2143c79444aaea,7,8,6,6,Wrong speak find.
DS-051,ongoing,f901930ee242484b8df50053,2024-02-27 07:04:47,2024-03-10 07:04:47,b4933d9916354a8091d67a15,9,1,7,5,Fine operation realize.
DS-051,ongoing,f901930ee242484b8df50053,2024-02-27 07:04:47,2024-03-10 07:04:47,f3afcbee49f5415c9ad12151,8,4,9,2,Civil though wonder design.
DS-051,ongoing,f901930ee242484b8df50053,2024-02-27 07:04:47,2024-03-10 07:04:47,5c7e805cf15e4994a4481548,6,0,6,7,Out get fast chance perform perform Democrat.
DS-051,ongoing,f901930ee242484b8df50053,2024-02-27 07:04:47,2024-03-10 07:04:47,0f3dd94a7c7046589aa5fa0a,5,10,9,9,Situation night maintain network few eight although decision.
DS-051,ongoing,f901930ee242484b8df50053,2024-02-27 07:04:47,2024-03-10 07:04:47,c59ae8d0942c438088d0bd5f,8,8,6,9,Environmental natural whether ability several.
DS-051,ongoing,f901930ee242484b8df50053,2024-02-27 07:04:47,2024-03-10 07:04:47,55d951dce3c04eb6b047f94b,8,5,5,2,Although how practice push agree Mr.
DS-051,ongoing,f901930ee242484b8df50053,2024-02-27 07:04:47,2024-03-10 07:04:47,97bd94e4b49944f791b7e20b,9,6,2,1,Best matter provide position management both fire.
DS-051,ongoing,f901930ee242484b8df50053,2024-02-27 07:04:47,2024-03-10 07:04:47,65d651f521ac417aa0c1d816,4,9,2,4,Sea tell realize method.
DS-051,ongoing,f901930ee242484b8df50053,2024-02-27 07:04:47,2024-03-10 07:04:47,094d662dbb0046ceb22f49de,6,2,5,0,Agency put wish century.
DS-051,ongoing,f901930ee242484b8df50053,2024-02-27 07:04:47,2024-03-10 07:04:47,c232e561bb72463e8025464f,5,2,1,8,Large movement how high.
DS-051,ongoing,f901930ee242484b8df50053,2024-02-27 07:04:47,2024-03-10 07:04:47,bde6184ab5cd4fd7afece08e,2,6,5,3,Issue up audience rule theory ground.
DS-051,ongoing,f901930ee242484b8df50053,2024-02-27 07:04:47,2024-03-10 07:04:47,0abcb8a5842742e295f2c135,2,1,5,3,Health military generation TV home development world.
DS-051,ongoing,f901930ee242484b8df50053,2024-02-27 07:04:47,2024-03-10 07:04:47,978a4c48d6574c4fb9877a26,6,8,9,6,Score style idea.
UI-052,completed,06d37cdf25144600a45e679f,2024-07-13 05:29:52,2024-07-31 05:29:52,b4aad24ba97c4b95a7ceff19,9,4,10,3,Prepare explain skin become take.
UI-052,completed,06d37cdf25144600a45e679f,2024-07-13 05:29:52,2024-07-31 05:29:52,bdc9c10082aa4f4695c6ec50,1,5,2,6,Wear old season feel training indeed west.
UI-052,completed,06d37cdf25144600a45e679f,2024-07-13 05:29:52,2024-07-31 05:29:52,5b781b0d3844483780d6e33a,1,1,6,9,Note attorney listen product.
UI-052,completed,06d37cdf25144600a45e679f,2024-07-13 05:29:52,2024-07-31 05:29:52,1ddaa379d2ce4070af5e9e9e,5,9,9,8,Million machine particularly away become.
UI-052,completed,06d37cdf25144600a45e679f,2024-07-13 05:29:52,2024-07-31 05:29:52,c9db6e0e266541d0a2b631b2,4,4,9,1,Community note shake.
UI-052,completed,06d37cdf25144600a45e679f,2024-07-13 05:29:52,2024-07-31 05:29:52,a3626c79b7ea4163aa3a6dbb,2,2,4,4,Than sport door particularly.
UI-052,completed,06d37cdf25144600a45e679f,2024-07-13 05:29:52,2024-07-31 05:29:52,04b9f83aada64d0e8320f0fc,6,6,9,3,See cold three artist economic course town.
UI-052,completed,06d37cdf25144600a45e679f,2024-07-13 05:29:52,2024-07-31 05:29:52,098665792afd49a795fcdd9c,6,7,7,1,Them finally enter fund.
UI-052,completed,06d37cdf25144600a45e679f,2024-07-13 05:29:52,2024-07-31 05:29:52,f0c58e254cfd40bd998e9de9,4,10,2,7,Entire none budget.
UI-052,completed,06d37cdf25144600a45e679f,2024-07-13 05:29:52,2024-07-31 05:29:52,5e3ca27d71df4ed6a5fbc552,7,7,7,7,Know cover character also miss do.
UI-052,completed,06d37cdf25144600a45e679f,2024-07-13 05:29:52,2024-07-31 05:29:52,a6ec6e5c30524137aa121edc,3,9,9,7,Interesting individual girl hard.
UI-052,completed,06d37cdf25144600a45e679f,2024-07-13 05:29:52,2024-07-31 05:29:52,707a9cbfdffa4853ab7e6810,2,1,10,8,Himself now example here.
UI-052,completed,06d37cdf25144600a45e679f,2024-07-13 05:29:52,2024-07-31 05:29:52,2fb78538d1cd40f590ac826f,5,8,4,4,Heart heart drug case shoulder choice.
DS-053,pending,c112b8f7fa9a4571a45816ba,2024-06-14 20:59:52,2024-06-16 20:59:52,a3cd1a4a496048d1a58558d5,7,3,1,6,Newspaper two create here.
DS-053,pending,c112b8f7fa9a4571a45816ba,2024-06-14 20:59:52,2024-06-16 20:59:52,1583e89d9bf54a42b8b3f708,5,5,6,6,Woman interview relate reflect bar account.
DS-053,pending,c112b8f7fa9a4571a45816ba,2024-06-14 20:59:52,2024-06-16 20:59:52,0d001f807da14176ba154424,8,1,1,2,List bank light accept.
DS-053,pending,c112b8f7fa9a4571a45816ba,2024-06-14 20:59:52,2024-06-16 20:59:52,eca088db92db43e582cd3dfc,4,5,6,0,Prevent north force eight quickly whole another.
DS-053,pending,c112b8f7fa9a4571a45816ba,2024-06-14 20:59:52,2024-06-16 20:59:52,aff1423e133b403282fcdc04,5,8,1,1,Open hospital imagine tree.
DS-053,pending,c112b8f7fa9a4571a45816ba,2024-06-14 20:59:52,2024-06-16 20:59:52,639b230179f54c0a8752f44a,10,5,2,7,Low author off social assume property.
DS-053,pending,c112b8f7fa9a4571a45816ba,2024-06-14 20:59:52,2024-06-16 20:59:52,0564250bed8d43e1839f0cc1,3,1,1,7,Nearly or a take billion.
DS-053,pending,c112b8f7fa9a4571a45816ba,2024-06-14 20:59:52,2024-06-16 20:59:52,42ad8606630a4e448e0f0919,0,1,10,1,Area movement forward what production surface.
DS-053,pending,c112b8f7fa9a4571a45816ba,2024-06-14 20:59:52,2024-06-16 20:59:52,e6844f8fb01a42dea4081a8c,7,7,4,4,Suggest single physical within anyone film move.
