training_code,status,trainer,startDate,endDate,participant_user,participant_hackerRankScore,participant_assessmentScore,participant_performance,participant_communication,participant_remarks
DE-024,ongoing,c112b8f7fa9a4571a45816ba,2024-05-16 16:34:31,2024-06-09 16:34:31,36aa7ca45a594de181bab17e,2,2,3,0,News instead threat yet civil soldier.
DE-024,ongoing,c112b8f7fa9a4571a45816ba,2024-05-16 16:34:31,2024-06-09 16:34:31,4839533d12b048a5b55efd52,4,3,5,8,Son situation call stop tough prove who environment.
DE-024,ongoing,c112b8f7fa9a4571a45816ba,2024-05-16 16:34:31,2024-06-09 16:34:31,35f64e86770544c38198da15,0,9,10,4,Free maintain various fast.
DE-024,ongoing,c112b8f7fa9a4571a45816ba,2024-05-16 16:34:31,2024-06-09 16:34:31,710a036c6fca4015b3da924c,8,7,7,5,Drop name day million fight church visit.
DE-024,ongoing,c112b8f7fa9a4571a45816ba,2024-05-16 16:34:31,2024-06-09 16:34:31,a321c70975df4410999d4064,5,4,3,6,Notice wish stuff rate a.
DE-024,ongoing,c112b8f7fa9a4571a45816ba,2024-05-16 16:34:31,2024-06-09 16:34:31,126a3d63705d4d14a1005509,9,6,5,0,Factor research phone me money.
DE-024,ongoing,c112b8f7fa9a4571a45816ba,2024-05-16 16:34:31,2024-06-09 16:34:31,1e1cba4d2e1a491190e4f4b1,2,2,3,7,Little institution lay actually song only stuff.
DE-024,ongoing,c112b8f7fa9a4571a45816ba,2024-05-16 16:34:31,2024-06-09 16:34:31,783661e18f9e436d8e625bf5,1,6,1,7,In behind TV dog news keep.
DE-024,ongoing,c112b8f7fa9a4571a45816ba,2024-05-16 16:34:31,2024-06-09 16:34:31,5ca2d7d3c6ce44ef8d66db11,4,2,8,8,Argue during month those talk evidence.
DE-024,ongoing,c112b8f7fa9a4571a45816ba,2024-05-16 16:34:31,2024-06-09 16:34:31,03496d9d5fa343249bb1f493,8,7,1,1,Question change work something me floor.
DE-024,ongoing,c112b8f7fa9a4571a45816ba,2024-05-16 16:34:31,2024-06-09 16:34:31,aff1423e133b403282fcdc04,4,0,9,2,Use truth message trouble care main hour.
DE-024,ongoing,c112b8f7fa9a4571a45816ba,2024-05-16 16:34:31,2024-06-09 16:34:31,d54f75fd04fe4aa6b7af46cf,7,10,1,7,Draw probably road natural blood trade star.
DE-024,ongoing,c112b8f7fa9a4571a45816ba,2024-05-16 16:34:31,2024-06-09 16:34:31,74a1b5a1e9724a75a1cd132b,4,5,6,7,Appear drive attorney avoid region teacher.
DE-024,ongoing,c112b8f7fa9a4571a45816ba,2024-05-16 16:34:31,2024-06-09 16:34:31,4c4e0d6e39c14fcba5c62d19,5,5,1,5,Company order water.
DE-024,ongoing,c112b8f7fa9a4571a45816ba,2024-05-16 16:34:31,2024-06-09 16:34:31,5960657de40c4a1e8cb5f4fb,10,7,6,4,Glass rate game pick citizen identify itself.
DE-024,ongoing,c112b8f7fa9a4571a45816ba,2024-05-16 16:34:31,2024-06-09 16:34:31,e9f03bb1e53a4ad9b54dbfb7,6,5,2,7,Couple rise but tree PM million project.
DE-024,ongoing,c112b8f7fa9a4571a45816ba,2024-05-16 16:34:31,2024-06-09 16:34:31,91add07646fb4ce6946dbcec,2,8,8,9,How factor hard detail teach.
DE-024,ongoing,c112b8f7fa9a4571a45816ba,2024-05-16 16:34:31,2024-06-09 16:34:31,b70e9e69636e42ea9808e5f8,2,3,10,6,Democratic lose style and person popular fire.
DE-024,ongoing,c112b8f7fa9a4571a45816ba,2024-05-16 16:34:31,2024-06-09 16:34:31,614f06e190e14ccb97f874eb,5,9,3,6,Tax development official they.
DE-024,ongoing,c112b8f7fa9a4571a45816ba,2024-05-16 16:34:31,2024-06-09 16:34:31,c0f56c7e8ccf4ccf98a7b77f,7,6,6,2,West stand treat federal special billion recent.
DE-025,completed,96f4b32573784f019e82a911,2024-08-05 04:45:39,2024-08-13 04:45:39,6dac4dc28c844f1eb0d42020,6,8,9,3,Four goal tonight as modern head amount.
DE-025,completed,96f4b32573784f019e82a911,2024-08-05 04:45:39,2024-08-13 04:45:39,f4b9a914639c410b92cca27d,2,7,4,7,Generation blue learn notice leader marriage.
DE-025,completed,96f4b32573784f019e82a911,2024-08-05 04:45:39,2024-08-13 04:45:39,8e29dc8b85ea4fae89311c78,1,4,4,1,Response population buy official without prepare ok.
DE-025,completed,96f4b32573784f019e82a911,2024-08-05 04:45:39,2024-08-13 04:45:39,284d986650a244c484f3c1a1,5,9,7,2,Occur audience cup your.
DE-025,completed,96f4b32573784f019e82a911,2024-08-05 04:45:39,2024-08-13 04:45:39,97b55ee694124eed85da2706,7,5,6,1,Ago sing western decision heavy difficult.
DE-025,completed,96f4b32573784f019e82a911,2024-08-05 04:45:39,2024-08-13 04:45:39,4c849324f3ef4cc19cf998e9,9,6,7,1,Name food want budget night leave.
DE-025,completed,96f4b32573784f019e82a911,2024-08-05 04:45:39,2024-08-13 04:45:39,03496d9d5fa343249bb1f493,5,8,10,9,Agreement huge radio rock.
DE-025,completed,96f4b32573784f019e82a911,2024-08-05 04:45:39,2024-08-13 04:45:39,8f220ac3d52a47029203236d,5,5,6,9,Cold morning very down pick discussion.
DE-025,completed,96f4b32573784f019e82a911,2024-08-05 04:45:39,2024-08-13 04:45:39,12d3a0824abc46f48e43800f,0,3,0,6,Reason reality partner.
DE-025,completed,96f4b32573784f019e82a911,2024-08-05 04:45:39,2024-08-13 04:45:39,5716cb899ef2436dbb5dc9db,9,1,7,7,Act no notice human camera.
DE-025,completed,96f4b32573784f019e82a911,2024-08-05 04:45:39,2024-08-13 04:45:39,1e1cba4d2e1a491190e4f4b1,8,6,3,2,Full factor truth coach popular.
DE-025,completed,96f4b32573784f019e82a911,2024-08-05 04:45:39,2024-08-13 04:45:39,53c3ecb4004a47ca85b9f218,6,1,5,5,Central beyond current arm explain result.
DE-025,completed,96f4b32573784f019e82a911,2024-08-05 04:45:39,2024-08-13 04:45:39,98b59bc100da42d99262b898,6,8,6,0,Avoid age subject population need upon.
DE-025,completed,96f4b32573784f019e82a911,2024-08-05 04:45:39,2024-08-13 04:45:39,1bfb954dd6d640a2aa67f776,0,7,5,7,Television available try mother message particular beat society.
DE-025,completed,96f4b32573784f019e82a911,2024-08-05 04:45:39,2024-08-13 04:45:39,b5148c0348ce4464b6f9aed1,8,8,9,4,Woman size young accept.
DE-025,completed,96f4b32573784f019e82a911,2024-08-05 04:45:39,2024-08-13 04:45:39,c146ef6823bd4aff9679634d,1,6,6,4,Education least house.
DE-025,completed,96f4b32573784f019e82a911,2024-08-05 04:45:39,2024-08-13 04:45:39,d0f93447ea854215bd750ff9,2,0,8,1,Bring article accept moment pretty.
DE-025,completed,96f4b32573784f019e82a911,2024-08-05 04:45:39,2024-08-13 04:45:39,058106dda8e7456f82404e7c,2,9,1,9,I process explain can case growth.
UI-026,ongoing,091df0f4c1874930ab65b31a,2024-05-03 09:07:59,2024-05-18 09:07:59,e9eab59152134be6862ff8d9,9,3,1,8,Fire black share far city view.
UI-026,ongoing,091df0f4c1874930ab65b31a,2024-05-03 09:07:59,2024-05-18 09:07:59,6dd7b2f7ec5046d39f09b886,0,8,2,0,Floor real affect green office job.
UI-026,ongoing,091df0f4c1874930ab65b31a,2024-05-03 09:07:59,2024-05-18 09:07:59,fc729920b4b742699a38286c,1,2,5,3,Same deal treat represent receive.
UI-026,ongoing,091df0f4c1874930ab65b31a,2024-05-03 09:07:59,2024-05-18 09:07:59,8fd6acf8da9c45a7a6f3a561,5,3,5,7,Field direction each bill fine focus.
UI-026,ongoing,091df0f4c1874930ab65b31a,2024-05-03 09:07:59,2024-05-18 09:07:59,edb4689cecad443fb9f253b9,5,0,5,6,Wide thus establish expect hospital.
UI-026,ongoing,091df0f4c1874930ab65b31a,2024-05-03 09:07:59,2024-05-18 09:07:59,75d360f64cce49ea8419f3d7,0,4,7,9,And education part.
UI-026,ongoing,091df0f4c1874930ab65b31a,2024-05-03 09:07:59,2024-05-18 09:07:59,75e20be4b0bc4dbdaaefeda1,2,10,1,5,First ago cup thought each trade true.
UI-026,ongoing,091df0f4c1874930ab65b31a,2024-05-03 09:07:59,2024-05-18 09:07:59,7d74459f98e54ac58dde335f,6,8,5,0,Detail space should success majority major teach must.
UI-026,ongoing,091df0f4c1874930ab65b31a,2024-05-03 09:07:59,2024-05-18 09:07:59,1a309a1d0514444b91d9e110,9,0,1,8,Anything one man beat.
UI-026,ongoing,091df0f4c1874930ab65b31a,2024-05-03 09:07:59,2024-05-18 09:07:59,cab2a2dddcf749f8bb1de1f1,9,9,6,6,Environmental eight well idea local never.
UI-026,ongoing,091df0f4c1874930ab65b31a,2024-05-03 09:07:59,2024-05-18 09:07:59,1fa294c9b03b4dd6be1c475c,10,8,10,9,Close without impact those.
UI-026,ongoing,091df0f4c1874930ab65b31a,2024-05-03 09:07:59,2024-05-18 09:07:59,5b781b0d3844483780d6e33a,1,4,5,7,Front our character explain pattern.
UI-026,ongoing,091df0f4c1874930ab65b31a,2024-05-03 09:07:59,2024-05-18 09:07:59,08e2dc3b7b3747abbabca52f,6,6,0,5,Serve quality threat.
UI-026,ongoing,091df0f4c1874930ab65b31a,2024-05-03 09:07:59,2024-05-18 09:07:59,9c4fefa5714045a4bf41313f,10,10,6,8,Police part wrong to performance throughout.
UI-026,ongoing,091df0f4c1874930ab65b31a,2024-05-03 09:07:59,2024-05-18 09:07:59,cd17faaf2707408eaa040f70,6,5,9,0,Wrong easy half behavior season stop.
UI-026,ongoing,091df0f4c1874930ab65b31a,2024-05-03 09:07:59,2024-05-18 09:07:59,4925980026da48c2b25fa3b7,3,2,1,2,Remain when occur training home.
UI-026,ongoing,091df0f4c1874930ab65b31a,2024-05-03 09:07:59,2024-05-18 09:07:59,97b55ee694124eed85da2706,10,5,9,7,Human state third stop tonight fight.
UI-026,ongoing,091df0f4c1874930ab65b31a,2024-05-03 09:07:59,2024-05-18 09:07:59,4af38438ee2d48789266d42b,7,0,4,7,American tonight ball fear body.
UI-026,ongoing,091df0f4c1874930ab65b31a,2024-05-03 09:07:59,2024-05-18 09:07:59,fd1542fddf9d41968c675d58,4,5,1,2,Within surface poor serious rather.
UI-026,ongoing,091df0f4c1874930ab65b31a,2024-05-03 09:07:59,2024-05-18 09:07:59,3553669dd04341aa89c84a2c,3,5,6,10,Edge also individual loss.
UI-026,ongoing,091df0f4c1874930ab65b31a,2024-05-03 09:07:59,2024-05-18 09:07:59,98b59bc100da42d99262b898,9,0,3,4,Sometimes consumer cup item cover more far.
UI-026,ongoing,091df0f4c1874930ab65b31a,2024-05-03 09:07:59,2024-05-18 09:07:59,05d402c73bcd4ebf96b85f03,2,10,6,8,Past information fire home believe consumer activity issue.
ST-027,completed,86653c47aced471b94bd9333,2024-03-03 10:28:12,2024-03-18 10:28:12,e2634c61d4bf4a38a83902ae,10,1,10,10,Produce create area attention.
ST-027,completed,86653c47aced471b94bd9333,2024-03-03 10:28:12,2024-03-18 10:28:12,e85ba742ba0f467fba066b75,4,5,3,9,Phone loss leg management.
ST-027,completed,86653c47aced471b94bd9333,2024-03-03 10:28:12,2024-03-18 10:28:12,a08bdf8f88b1417b92741efc,9,4,5,5,Bit animal evidence nearly wall whatever.
ST-027,completed,86653c47aced471b94bd9333,2024-03-03 10:28:12,2024-03-18 10:28:12,34f05a2985da4fd39d1afe75,4,9,9,3,Man mean risk less training.
ST-027,completed,86653c47aced471b94bd9333,2024-03-03 10:28:12,2024-03-18 10:28:12,656c8586624a47b6bde48295,2,5,4,4,Bank measure science apply strategy share life.
ST-027,completed,86653c47aced471b94bd9333,2024-03-03 10:28:12,2024-03-18 10:28:12,5d99b82c4dae4a1397fe1ec3,6,3,5,1,One degree someone form size student improve.
ST-027,completed,86653c47aced471b94bd9333,2024-03-03 10:28:12,2024-03-18 10:28:12,9a2774bd0bd24581a12e90b6,6,2,3,8,Old have imagine response.
ST-027,completed,86653c47aced471b94bd9333,2024-03-03 10:28:12,2024-03-18 10:28:12,49fd1b5b32c94d0284920c41,5,8,0,6,Part hour possible almost growth population sea.
ST-027,completed,86653c47aced471b94bd9333,2024-03-03 10:28:12,2024-03-18 10:28:12,d3fea706bbfa47a5b5c64c58,6,7,1,0,Choose lay bad computer sell good late.
ST-027,completed,86653c47aced471b94bd9333,2024-03-03 10:28:12,2024-03-18 10:28:12,3be0fcea251c484ea275db15,3,3,9,4,Certain health quite attack eight recent.
ST-027,completed,86653c47aced471b94bd9333,2024-03-03 10:28:12,2024-03-18 10:28:12,b70e9e69636e42ea9808e5f8,0,1,0,4,Phone identify I picture up recent play.
ST-027,completed,86653c47aced471b94bd9333,2024-03-03 10:28:12,2024-03-18 10:28:12,72fadead725e49db90e20ad6,9,2,2,6,Anything executive there prepare bill production.
ST-027,completed,86653c47aced471b94bd9333,2024-03-03 10:28:12,2024-03-18 10:28:12,0ae20f03020d4b2c88fa8510,8,2,7,8,Ground miss guy democratic hundred.
ST-027,completed,86653c47aced471b94bd9333,2024-03-03 10:28:12,2024-03-18 10:28:12,c771f42b1edd4d25b7ffa88f,5,8,2,1,Long nothing happen word defense entire discuss song.
ST-027,completed,86653c47aced471b94bd9333,2024-03-03 10:28:12,2024-03-18 10:28:12,913e2494ce7046d0b7d62788,2,0,6,6,Difficult blue radio power authority generation.
ST-027,completed,86653c47aced471b94bd9333,2024-03-03 10:28:12,2024-03-18 10:28:12,98b59bc100da42d99262b898,1,3,3,4,Work ask send risk individual pressure reflect.
DE-028,completed,d1a280ded3c7423197b2cda1,2024-02-17 02:09:57,2024-02-20 02:09:57,ff385f5fe4f14626ae670071,5,8,5,3,Outside score provide TV.
DE-028,completed,d1a280ded3c7423197b2cda1,2024-02-17 02:09:57,2024-02-20 02:09:57,4839a185af7e45bbb86dce6d,4,4,8,4,Arm all after yes.
DE-028,completed,d1a280ded3c7423197b2cda1,2024-02-17 02:09:57,2024-02-20 02:09:57,33ea71eefbba456487e7947f,4,8,1,3,Paper society assume become.
DE-028,completed,d1a280ded3c7423197b2cda1,2024-02-17 02:09:57,2024-02-20 02:09:57,a9112a3d69e24d259db5f2f8,9,9,8,8,Institution seek talk.
DE-028,completed,d1a280ded3c7423197b2cda1,2024-02-17 02:09:57,2024-02-20 02:09:57,8979c62b06d542efb707e3a0,3,4,3,2,Dinner affect account sense generation thing learn.
DE-028,completed,d1a280ded3c7423197b2cda1,2024-02-17 02:09:57,2024-02-20 02:09:57,1ebae459f5c44aa8a0c5b1c4,3,6,5,1,Card perhaps well agent something.
DE-028,completed,d1a280ded3c7423197b2cda1,2024-02-17 02:09:57,2024-02-20 02:09:57,31fbfe6566fb42e08da73c8c,6,6,8,2,Value build easy threat.
DE-028,completed,d1a280ded3c7423197b2cda1,2024-02-17 02:09:57,2024-02-20 02:09:57,5beb3da41d01420fae13427d,9,1,2,2,Cultural everyone loss training charge final.
DE-028,completed,d1a280ded3c7423197b2cda1,2024-02-17 02:09:57,2024-02-20 02:09:57,a51533fa30ae4ff7a3741350,7,6,9,9,When mention among open know including.
DE-028,completed,d1a280ded3c7423197b2cda1,2024-02-17 02:09:57,2024-02-20 02:09:57,7656c5ef34024d85bd2c5b07,6,10,4,7,Protect suffer recently establish message down.
DE-028,completed,d1a280ded3c7423197b2cda1,2024-02-17 02:09:57,2024-02-20 02:09:57,f5bca7d0b9a441d785e87b51,8,8,3,5,Against take admit commercial.
DE-028,completed,d1a280ded3c7423197b2cda1,2024-02-17 02:09:57,2024-02-20 02:09:57,119c04c9327a4d0e945d5e4b,2,7,2,1,Last these road evening public response.
DE-028,completed,d1a280ded3c7423197b2cda1,2024-02-17 02:09:57,2024-02-20 02:09:57,52188dd5394746b2a0f1bcee,9,10,3,8,Mention company up.
DE-028,completed,d1a280ded3c7423197b2cda1,2024-02-17 02:09:57,2024-02-20 02:09:57,5e71289182d549cfbbfdf255,6,4,5,1,Mention main others message man late.
DE-028,completed,d1a280ded3c7423197b2cda1,2024-02-17 02:09:57,2024-02-20 02:09:57,8306842d7bbc4be095e04e31,5,4,1,0,Move beautiful movie care.
DE-028,completed,d1a280ded3c7423197b2cda1,2024-02-17 02:09:57,2024-02-20 02:09:57,99437633f11541d5b78e41cb,7,1,1,0,Door blue people.
DE-028,completed,d1a280ded3c7423197b2cda1,2024-02-17 02:09:57,2024-02-20 02:09:57,537217f775c0466fb10f6564,6,2,2,9,Bar which billion.
DE-028,completed,d1a280ded3c7423197b2cda1,2024-02-17 02:09:57,2024-02-20 02:09:57,afb56c26572e4b03ba794695,0,10,2,0,Politics including rest agent.
DE-028,completed,d1a280ded3c7423197b2cda1,2024-02-17 02:09:57,2024-02-20 02:09:57,ede3ef88ca404b078a027742,1,9,4,8,Social set Mr page wide property.
DE-028,completed,d1a280ded3c7423197b2cda1,2024-02-17 02:09:57,2024-02-20 02:09:57,12d3a0824abc46f48e43800f,2,10,3,8,Across follow involve significant according sister two wait.
ST-029,pending,cef9ea1c2c5c4ac785c10e49,2024-04-27 07:52:39,2024-04-29 07:52:39,1aff614a2b1a4c68b85a6664,3,2,8,5,Bill film service do hold paper.
ST-029,pending,cef9ea1c2c5c4ac785c10e49,2024-04-27 07:52:39,2024-04-29 07:52:39,b40e90e3a02a4126a2f72e26,2,4,7,0,Activity produce network bed party admit increase up.
ST-029,pending,cef9ea1c2c5c4ac785c10e49,2024-04-27 07:52:39,2024-04-29 07:52:39,bac5ce19514845e6ad748c1e,2,8,4,1,Day leg skill with Democrat.
ST-029,pending,cef9ea1c2c5c4ac785c10e49,2024-04-27 07:52:39,2024-04-29 07:52:39,c03b18eb1e20403d9f3a492b,5,7,7,9,Get them technology arrive six.
ST-029,pending,cef9ea1c2c5c4ac785c10e49,2024-04-27 07:52:39,2024-04-29 07:52:39,45da28d740ed4c1b968b0a54,0,8,9,6,Upon pay figure her national discussion section.
ST-029,pending,cef9ea1c2c5c4ac785c10e49,2024-04-27 07:52:39,2024-04-29 07:52:39,edb4689cecad443fb9f253b9,3,6,7,2,Discuss cell assume.
ST-029,pending,cef9ea1c2c5c4ac785c10e49,2024-04-27 07:52:39,2024-04-29 07:52:39,9476141ca1cf4a5fbbac5127,4,1,9,1,Member down above front Republican change family.
ST-029,pending,cef9ea1c2c5c4ac785c10e49,2024-04-27 07:52:39,2024-04-29 07:52:39,4e1cad23a2bb4ce691b585ca,8,1,6,1,Real ability approach five everything.
ST-029,pending,cef9ea1c2c5c4ac785c10e49,2024-04-27 07:52:39,2024-04-29 07:52:39,a51533fa30ae4ff7a3741350,3,8,5,1,Age particularly media way respond sign.
ST-029,pending,cef9ea1c2c5c4ac785c10e49,2024-04-27 07:52:39,2024-04-29 07:52:39,9bede043ea4248f298c10f55,3,5,8,9,Answer actually fund share event well.
ST-029,pending,cef9ea1c2c5c4ac785c10e49,2024-04-27 07:52:39,2024-04-29 07:52:39,71408382f92445bd8dfc9b51,0,5,6,6,No though market sing pay wish hear model.
ST-029,pending,cef9ea1c2c5c4ac785c10e49,2024-04-27 07:52:39,2024-04-29 07:52:39,5bb4abc02df74022a85bf4cc,5,5,0,3,Expect fear because right yourself agreement civil.
ST-029,pending,cef9ea1c2c5c4ac785c10e49,2024-04-27 07:52:39,2024-04-29 07:52:39,5a5914ee3db74c1c9187a15c,1,0,4,8,Anything color discover ten occur.
ST-029,pending,cef9ea1c2c5c4ac785c10e49,2024-04-27 07:52:39,2024-04-29 07:52:39,68474e4205834610be686993,9,6,1,3,Service street expert policy.
ST-029,pending,cef9ea1c2c5c4ac785c10e49,2024-04-27 07:52:39,2024-04-29 07:52:39,8db611f5169e402da944c7b9,6,2,0,7,Right so relate best half page.
ST-029,pending,cef9ea1c2c5c4ac785c10e49,2024-04-27 07:52:39,2024-04-29 07:52:39,04d513501f44423db13c72eb,8,4,10,4,Surface another example hear number improve.
ST-029,pending,cef9ea1c2c5c4ac785c10e49,2024-04-27 07:52:39,2024-04-29 07:52:39,06685d5ec2fc47de9ae0f24d,2,9,9,1,Sport other but adult.
ST-029,pending,cef9ea1c2c5c4ac785c10e49,2024-04-27 07:52:39,2024-04-29 07:52:39,92ad7f7e8b334f9598b5f6e2,3,9,4,6,They property trip reduce.
ST-029,pending,cef9ea1c2c5c4ac785c10e49,2024-04-27 07:52:39,2024-04-29 07:52:39,cc2ce52dc0684fb79f6ce725,9,1,1,2,Every real ready.
ST-029,pending,cef9ea1c2c5c4ac785c10e49,2024-04-27 07:52:39,2024-04-29 07:52:39,7656c5ef34024d85bd2c5b07,2,5,1,4,Political easy finally baby rule gas short fine.
FS-030,completed,06db2ed4fe764611b51f19ae,2024-04-02 05:32:01,2024-04-08 05:32:01,007d0dc0a8264a32b4cab95b,4,4,8,0,Task enjoy past institution.
FS-030,completed,06db2ed4fe764611b51f19ae,2024-04-02 05:32:01,2024-04-08 05:32:01,c468c4b2537f4dd2b3dc0018,2,10,9,2,Security put catch political become.
FS-030,completed,06db2ed4fe764611b51f19ae,2024-04-02 05:32:01,2024-04-08 05:32:01,9fd9876d09424e8281f2ae8b,6,3,3,1,Score believe while some.
FS-030,completed,06db2ed4fe764611b51f19ae,2024-04-02 05:32:01,2024-04-08 05:32:01,6bda595629724b8f91988640,1,5,8,5,Very smile red physical.
FS-030,completed,06db2ed4fe764611b51f19ae,2024-04-02 05:32:01,2024-04-08 05:32:01,357dd7b0fb94466baad07940,2,9,9,1,Station machine option window statement free.
FS-030,completed,06db2ed4fe764611b51f19ae,2024-04-02 05:32:01,2024-04-08 05:32:01,98ed60123dc04f50b81575a2,3,5,6,3,Respond beyond seven.
FS-030,completed,06db2ed4fe764611b51f19ae,2024-04-02 05:32:01,2024-04-08 05:32:01,5b3a9954e361447396dcec91,0,9,2,3,Effect tonight within give join.
FS-030,completed,06db2ed4fe764611b51f19ae,2024-04-02 05:32:01,2024-04-08 05:32:01,583009360661466394e80055,4,10,7,8,Medical truth manager be democratic trip only.
FS-030,completed,06db2ed4fe764611b51f19ae,2024-04-02 05:32:01,2024-04-08 05:32:01,e16207cc91a24c5ba153fce0,6,7,4,0,Within machine artist election majority in past.
FS-030,completed,06db2ed4fe764611b51f19ae,2024-04-02 05:32:01,2024-04-08 05:32:01,7436622c505043e386dc6b92,1,7,9,8,Center whose job help hair their.
FS-030,completed,06db2ed4fe764611b51f19ae,2024-04-02 05:32:01,2024-04-08 05:32:01,57a66945e48945b18ba8614b,10,9,7,6,Source deal tree wall listen three.
FS-030,completed,06db2ed4fe764611b51f19ae,2024-04-02 05:32:01,2024-04-08 05:32:01,fa6864f48fa14965820b1df6,8,9,8,9,Community story before seven race reveal term.
FS-030,completed,06db2ed4fe764611b51f19ae,2024-04-02 05:32:01,2024-04-08 05:32:01,25f2ede39da648648b3fc784,2,7,6,5,Program theory what generation those the.
FS-030,completed,06db2ed4fe764611b51f19ae,2024-04-02 05:32:01,2024-04-08 05:32:01,cc657be63a974bc6b9e8e1ab,0,1,1,7,Detail really capital war people.
FS-030,completed,06db2ed4fe764611b51f19ae,2024-04-02 05:32:01,2024-04-08 05:32:01,d1b95a2c238447fe9ee4220f,2,7,1,3,Job lot house way article.
FS-030,completed,06db2ed4fe764611b51f19ae,2024-04-02 05:32:01,2024-04-08 05:32:01,b8c5ec6290d8409095e60962,10,1,10,4,Car seat instead answer article role.
FS-030,completed,06db2ed4fe764611b51f19ae,2024-04-02 05:32:01,2024-04-08 05:32:01,4085a81f47dc4ba9a7735d4e,0,6,9,6,Collection these degree somebody school shake.
FS-030,completed,06db2ed4fe764611b51f19ae,2024-04-02 05:32:01,2024-04-08 05:32:01,2c46fcfdb03e4ced814c7190,7,5,3,4,Prepare true increase seek leg industry.
FS-030,completed,06db2ed4fe764611b51f19ae,2024-04-02 05:32:01,2024-04-08 05:32:01,a70b4e352b594fa2b9779504,10,8,5,4,Though show candidate despite.
FS-030,completed,06db2ed4fe764611b51f19ae,2024-04-02 05:32:01,2024-04-08 05:32:01,284d986650a244c484f3c1a1,6,5,3,9,Mention sea investment Democrat degree executive.
FS-030,completed,06db2ed4fe764611b51f19ae,2024-04-02 05:32:01,2024-04-08 05:32:01,0e729793876c42d38ab5c374,2,1,3,8,Stage service understand particular us look.
FS-030,completed,06db2ed4fe764611b51f19ae,2024-04-02 05:32:01,2024-04-08 05:32:01,0e8974c27f9c4bc481a49b68,9,2,3,7,Sign medical note special effect.
FS-030,completed,06db2ed4fe764611b51f19ae,2024-04-02 05:32:01,2024-04-08 05:32:01,5674b309cb524c7d9e9d38ad,2,5,6,6,Hand decade board body floor a fire.
DE-031,pending,a20972c1f7e54bed941462cd,2024-09-25 09:03:55,2024-10-19 09:03:55,df5de537193942e696aacfef,9,6,2,5,List cut recognize lot each kid past sign.
DE-031,pending,a20972c1f7e54bed941462cd,2024-09-25 09:03:55,2024-10-19 09:03:55,136d75b8612e4c4fbb1a2167,10,4,4,1,Coach rock culture.
DE-031,pending,a20972c1f7e54bed941462cd,2024-09-25 09:03:55,2024-10-19 09:03:55,9850c692b77b4682a161c0c8,4,9,9,2,Of impact campaign world.
DE-031,pending,a20972c1f7e54bed941462cd,2024-09-25 09:03:55,2024-10-19 09:03:55,f03d85460687464eb2f5ae5b,3,3,4,9,Themselves foot room better instead story firm.
DE-031,pending,a20972c1f7e54bed941462cd,2024-09-25 09:03:55,2024-10-19 09:03:55,bd10bca44be241acb7dedda9,2,2,4,8,Speech page who enjoy campaign.
DE-031,pending,a20972c1f7e54bed941462cd,2024-09-25 09:03:55,2024-10-19 09:03:55,e7dac1b2cf064feb9fc51ca8,4,6,3,2,Edge stuff financial among positive left stand.
DE-031,pending,a20972c1f7e54bed941462cd,2024-09-25 09:03:55,2024-10-19 09:03:55,8fd5151e0e4741d182ddd0ac,0,4,4,5,Book environmental light debate.
DE-031,pending,a20972c1f7e54bed941462cd,2024-09-25 09:03:55,2024-10-19 09:03:55,7b5565642bc74d83b24df138,5,3,7,5,Weight guy sing every experience poor race.
DE-031,pending,a20972c1f7e54bed941462cd,2024-09-25 09:03:55,2024-10-19 09:03:55,1718566075aa48a7b337933d,3,6,3,0,Even president stock risk forward.
DE-031,pending,a20972c1f7e54bed941462cd,2024-09-25 09:03:55,2024-10-19 09:03:55,7654d369b436454893391f2d,4,7,0,6,Next section seem however prepare indicate beat never.
DE-031,pending,a20972c1f7e54bed941462cd,2024-09-25 09:03:55,2024-10-19 09:03:55,117929860aeb48b58b0934da,2,3,3,6,In fight admit role rather.
DE-031,pending,a20972c1f7e54bed941462cd,2024-09-25 09:03:55,2024-10-19 09:03:55,cd43af22900a48ca85afe125,10,10,5,2,Physical within worker mouth spring media allow.
DE-031,pending,a20972c1f7e54bed941462cd,2024-09-25 09:03:55,2024-10-19 09:03:55,2a2eefd57c9d472fb947d89a,1,2,10,1,Amount at reality.
DE-031,pending,a20972c1f7e54bed941462cd,2024-09-25 09:03:55,2024-10-19 09:03:55,4ffb11bdabc149a5afe48d10,8,6,5,3,Bed forget group this.
DE-031,pending,a20972c1f7e54bed941462cd,2024-09-25 09:03:55,2024-10-19 09:03:55,03ac916a4c284c0e91b68bd2,9,4,9,6,Effort focus peace right.
DE-031,pending,a20972c1f7e54bed941462cd,2024-09-25 09:03:55,2024-10-19 09:03:55,288a58fa396548a8aafaa7a7,3,6,9,8,Against tough her none determine really.
DE-031,pending,a20972c1f7e54bed941462cd,2024-09-25 09:03:55,2024-10-19 09:03:55,5dfc274b49c245109ab0d9bf,9,10,4,6,Which worry first stage blood guy increase send.
DE-031,pending,a20972c1f7e54bed941462cd,2024-09-25 09:03:55,2024-10-19 09:03:55,f60e6c1503e249c0900465fc,6,7,8,7,Inside structure defense series possible whom adult local.
DE-031,pending,a20972c1f7e54bed941462cd,2024-09-25 09:03:55,2024-10-19 09:03:55,5f50197b93214b63ad794314,2,0,10,3,Suddenly answer exactly prevent.
DE-031,pending,a20972c1f7e54bed941462cd,2024-09-25 09:03:55,2024-10-19 09:03:55,04249dfbca5c4db7bf0763fc,3,3,4,9,Republican politics want buy walk majority kind certain.
DE-031,pending,a20972c1f7e54bed941462cd,2024-09-25 09:03:55,2024-10-19 09:03:55,d9db7efa8c1e43468f119748,7,10,3,9,Record seven late.
DE-031,pending,a20972c1f7e54bed941462cd,2024-09-25 09:03:55,2024-10-19 09:03:55,fdab5c63021a4857bab966a9,10,10,1,6,Worker number step receive American attack model build.
DE-031,pending,a20972c1f7e54bed941462cd,2024-09-25 09:03:55,2024-10-19 09:03:55,5bb4abc02df74022a85bf4cc,2,7,4,6,Sound lot similar red while hot.
DE-031,pending,a20972c1f7e54bed941462cd,2024-09-25 09:03:55,2024-10-19 09:03:55,97b5ad4a553a4b7788d32010,4,9,3,6,Bank well environment as third.
DE-031,pending,a20972c1f7e54bed941462cd,2024-09-25 09:03:55,2024-10-19 09:03:55,f43292da42264ee6964f634e,6,9,3,6,Seek do home.
DE-031,pending,a20972c1f7e54bed941462cd,2024-09-25 09:03:55,2024-10-19 09:03:55,946b10b2173b4bff8782a055,1,0,4,0,Model PM enjoy choice show agreement.
DE-031,pending,a20972c1f7e54bed941462cd,2024-09-25 09:03:55,2024-10-19 09:03:55,bb51b03983004db896c50c71,7,8,6,7,Official quality pay.
DS-032,completed,3d9a3c5243c54d738a44b301,2024-04-15 22:52:10,2024-05-08 22:52:10,41379ffefb9143d0bc748667,9,1,2,6,Soon often as open upon.
DS-032,completed,3d9a3c5243c54d738a44b301,2024-04-15 22:52:10,2024-05-08 22:52:10,055f7215dc98452d86bbf6e2,8,5,9,0,Take responsibility itself color.
DS-032,completed,3d9a3c5243c54d738a44b301,2024-04-15 22:52:10,2024-05-08 22:52:10,4167d7feceea4b66a3f68b43,6,8,1,4,Truth note partner everybody network.
DS-032,completed,3d9a3c5243c54d738a44b301,2024-04-15 22:52:10,2024-05-08 22:52:10,fba68e5544444bae8bb127e5,1,7,3,9,Eight read property with TV almost.
