training_code,status,trainer,startDate,endDate,participant_user,participant_hackerRankScore,participant_assessmentScore,participant_performance,participant_communication,participant_remarks
ST-001,pending,eb8428f0e22540bdb7d0a49a,2024-02-28 20:25:46,2024-03-06 20:25:46,aa1ba156b66443d1a22c870e,1,8,6,9,Whose onto surface after stand seven.
ST-001,pending,eb8428f0e22540bdb7d0a49a,2024-02-28 20:25:46,2024-03-06 20:25:46,62bbf5482c274d408737fa4d,1,9,1,6,Pick parent information work.
ST-001,pending,eb8428f0e22540bdb7d0a49a,2024-02-28 20:25:46,2024-03-06 20:25:46,df27b970451949b0a5474ad0,3,9,6,8,Drop take under senior training possible bar theory.
ST-001,pending,eb8428f0e22540bdb7d0a49a,2024-02-28 20:25:46,2024-03-06 20:25:46,058106dda8e7456f82404e7c,2,3,0,6,West kitchen authority man suddenly lead into.
ST-001,pending,eb8428f0e22540bdb7d0a49a,2024-02-28 20:25:46,2024-03-06 20:25:46,4839a185af7e45bbb86dce6d,3,3,3,1,Meeting friend light arrive child environmental law.
ST-001,pending,eb8428f0e22540bdb7d0a49a,2024-02-28 20:25:46,2024-03-06 20:25:46,5ff19dfea62c49caad032e7d,5,2,7,3,Will price black hotel she go send.
ST-001,pending,eb8428f0e22540bdb7d0a49a,2024-02-28 20:25:46,2024-03-06 20:25:46,6491571574d844b19266d623,3,7,7,9,Head break ok maintain again best three.
ST-001,pending,eb8428f0e22540bdb7d0a49a,2024-02-28 20:25:46,2024-03-06 20:25:46,d8e086b485644c25a7dab207,9,4,3,2,Approach question machine police blood effort.
ST-001,pending,eb8428f0e22540bdb7d0a49a,2024-02-28 20:25:46,2024-03-06 20:25:46,3ec04217b3774a189b534475,9,4,4,10,Exactly news six stage quality well phone.
ST-001,pending,eb8428f0e22540bdb7d0a49a,2024-02-28 20:25:46,2024-03-06 20:25:46,639b230179f54c0a8752f44a,10,8,5,6,Sister perhaps various hand order deal.
ST-001,pending,eb8428f0e22540bdb7d0a49a,2024-02-28 20:25:46,2024-03-06 20:25:46,32f553e104854cc080ee81ad,10,0,2,2,Exist least his leg staff.
ST-001,pending,eb8428f0e22540bdb7d0a49a,2024-02-28 20:25:46,2024-03-06 20:25:46,2c47faf681fa471485a8f4c2,2,4,9,1,Easy recently politics me.
ST-001,pending,eb8428f0e22540bdb7d0a49a,2024-02-28 20:25:46,2024-03-06 20:25:46,6e6e4f0808774ef0bef3df0e,4,8,1,6,Way letter cut suggest air want risk.
ST-001,pending,eb8428f0e22540bdb7d0a49a,2024-02-28 20:25:46,2024-03-06 20:25:46,a4e3385364794ef4b32f1e49,2,1,1,1,Account idea respond above already fish.
UI-002,ongoing,1a242c4ad1c140e6910700c8,2024-06-28 21:32:09,2024-07-05 21:32:09,b906763d6d9a492190deb6f0,3,8,1,4,Candidate character agency white audience.
UI-002,ongoing,1a242c4ad1c140e6910700c8,2024-06-28 21:32:09,2024-07-05 21:32:09,5716cb899ef2436dbb5dc9db,9,9,2,0,Off to wide outside admit talk try.
UI-002,ongoing,1a242c4ad1c140e6910700c8,2024-06-28 21:32:09,2024-07-05 21:32:09,4f9ef60344474f57b6eaefd8,1,9,6,3,Lawyer process share even appear hospital sometimes.
UI-002,ongoing,1a242c4ad1c140e6910700c8,2024-06-28 21:32:09,2024-07-05 21:32:09,cd4a77c4901248109e627418,7,10,8,2,Century chair wall place college write.
UI-002,ongoing,1a242c4ad1c140e6910700c8,2024-06-28 21:32:09,2024-07-05 21:32:09,40910ae987df4790b719cf29,0,2,2,6,Difficult attorney model matter way executive professional.
UI-002,ongoing,1a242c4ad1c140e6910700c8,2024-06-28 21:32:09,2024-07-05 21:32:09,cff435b6a095474ca6743399,8,6,2,2,Every subject develop indeed prevent him often.
UI-002,ongoing,1a242c4ad1c140e6910700c8,2024-06-28 21:32:09,2024-07-05 21:32:09,7c22e27d3d894952a6c1adac,5,9,8,6,If future report bar there.
UI-002,ongoing,1a242c4ad1c140e6910700c8,2024-06-28 21:32:09,2024-07-05 21:32:09,32a053e2e07d4fdb9c0f6440,2,7,6,9,System east agent issue.
UI-002,ongoing,1a242c4ad1c140e6910700c8,2024-06-28 21:32:09,2024-07-05 21:32:09,a9f076cb048041519b2bf282,6,2,1,1,Serve indicate leave then return.
UI-003,ongoing,90b7cae3ee2745bd9f099276,2024-03-30 06:21:03,2024-04-02 06:21:03,a08bdf8f88b1417b92741efc,4,5,3,6,Region result war give group customer member.
UI-003,ongoing,90b7cae3ee2745bd9f099276,2024-03-30 06:21:03,2024-04-02 06:21:03,5bb4abc02df74022a85bf4cc,7,5,3,4,Million attack those exactly onto career.
UI-003,ongoing,90b7cae3ee2745bd9f099276,2024-03-30 06:21:03,2024-04-02 06:21:03,ed03026bbeed4f85bcac706f,1,1,1,3,Blood particularly around oil.
UI-003,ongoing,90b7cae3ee2745bd9f099276,2024-03-30 06:21:03,2024-04-02 06:21:03,392018b4fdd4415eb9492208,6,1,4,4,Foot interview official hotel every general.
UI-003,ongoing,90b7cae3ee2745bd9f099276,2024-03-30 06:21:03,2024-04-02 06:21:03,53d3409c7b8d420295620bfe,1,0,10,0,Truth tonight test structure.
UI-003,ongoing,90b7cae3ee2745bd9f099276,2024-03-30 06:21:03,2024-04-02 06:21:03,1b22f0f267ca44809e75df73,10,3,4,4,Heavy protect another image administration these part.
UI-003,ongoing,90b7cae3ee2745bd9f099276,2024-03-30 06:21:03,2024-04-02 06:21:03,478b67741b9149e6aba01c32,7,7,1,1,Visit state boy under whom.
UI-003,ongoing,90b7cae3ee2745bd9f099276,2024-03-30 06:21:03,2024-04-02 06:21:03,ac4be49193e14cd89f6efc2c,6,3,6,9,Red industry model street policy.
UI-003,ongoing,90b7cae3ee2745bd9f099276,2024-03-30 06:21:03,2024-04-02 06:21:03,119c04c9327a4d0e945d5e4b,7,7,2,8,Learn clear cup series democratic since.
UI-003,ongoing,90b7cae3ee2745bd9f099276,2024-03-30 06:21:03,2024-04-02 06:21:03,2b3bda0553f2471c8bf7d5f8,3,4,3,8,Computer able adult support forward open coach fine.
UI-003,ongoing,90b7cae3ee2745bd9f099276,2024-03-30 06:21:03,2024-04-02 06:21:03,56ff8ae77d874b20b6fce7ba,9,3,10,7,Affect table how behind dinner drop.
UI-003,ongoing,90b7cae3ee2745bd9f099276,2024-03-30 06:21:03,2024-04-02 06:21:03,ff385f5fe4f14626ae670071,6,6,10,6,Ability sell side project.
UI-003,ongoing,90b7cae3ee2745bd9f099276,2024-03-30 06:21:03,2024-04-02 06:21:03,c9b7fda342cb40f0818f33eb,7,3,4,2,Business deal democratic put enter professional.
UI-003,ongoing,90b7cae3ee2745bd9f099276,2024-03-30 06:21:03,2024-04-02 06:21:03,411ebcad41e04e14935660ea,2,7,3,0,Strong central something space.
UI-003,ongoing,90b7cae3ee2745bd9f099276,2024-03-30 06:21:03,2024-04-02 06:21:03,bcfd8aed1bb949aa95445fc0,6,3,0,2,Four even pull.
UI-003,ongoing,90b7cae3ee2745bd9f099276,2024-03-30 06:21:03,2024-04-02 06:21:03,b6e85a2d440d40f9a0a2c63d,2,7,5,3,Provide trouble policy politics total speech room.
UI-003,ongoing,90b7cae3ee2745bd9f099276,2024-03-30 06:21:03,2024-04-02 06:21:03,d0f93447ea854215bd750ff9,9,7,3,7,Hospital middle bar real the nor continue.
UI-003,ongoing,90b7cae3ee2745bd9f099276,2024-03-30 06:21:03,2024-04-02 06:21:03,f2b25fe2cbef4a9098df36d7,1,7,5,1,Identify attention rock difficult civil.
UI-003,ongoing,90b7cae3ee2745bd9f099276,2024-03-30 06:21:03,2024-04-02 06:21:03,656c8586624a47b6bde48295,9,3,1,10,Mouth PM record movement good six.
DS-004,completed,3aa3f5c5ad35403d89c23f96,2024-07-12 23:01:17,2024-08-05 23:01:17,690a46efc18a447d97dc9f9a,6,1,4,6,Few have magazine two final stage contain.
DS-004,completed,3aa3f5c5ad35403d89c23f96,2024-07-12 23:01:17,2024-08-05 23:01:17,c98a4b82f95945e1bd489faf,4,0,8,6,Onto seven property series too rate total.
DS-004,completed,3aa3f5c5ad35403d89c23f96,2024-07-12 23:01:17,2024-08-05 23:01:17,4416d0c2da7c499e94ee4644,5,8,9,6,Attack tonight might.
DS-004,completed,3aa3f5c5ad35403d89c23f96,2024-07-12 23:01:17,2024-08-05 23:01:17,4438ab71cf4a4bfaa449b838,6,9,8,9,Dog part smile.
DS-004,completed,3aa3f5c5ad35403d89c23f96,2024-07-12 23:01:17,2024-08-05 23:01:17,3fdadeb3dc974bae99296d5e,1,10,5,1,War participant brother new project style.
DS-004,completed,3aa3f5c5ad35403d89c23f96,2024-07-12 23:01:17,2024-08-05 23:01:17,0e8974c27f9c4bc481a49b68,4,10,6,6,When crime two manage suffer send answer current.
DS-004,completed,3aa3f5c5ad35403d89c23f96,2024-07-12 23:01:17,2024-08-05 23:01:17,35dc7916b68049ed81effdfe,2,1,2,6,Hope clearly difficult analysis save anyone make.
DS-004,completed,3aa3f5c5ad35403d89c23f96,2024-07-12 23:01:17,2024-08-05 23:01:17,c146ef6823bd4aff9679634d,1,9,7,2,Already piece treat son us.
DS-004,completed,3aa3f5c5ad35403d89c23f96,2024-07-12 23:01:17,2024-08-05 23:01:17,d91f2c596d664c378d10ec6a,1,2,9,9,Movement purpose seat into politics whom suddenly.
DS-004,completed,3aa3f5c5ad35403d89c23f96,2024-07-12 23:01:17,2024-08-05 23:01:17,f17b84b8208f45ee9d61aed0,2,5,2,4,International table news enjoy film.
DS-004,completed,3aa3f5c5ad35403d89c23f96,2024-07-12 23:01:17,2024-08-05 23:01:17,1403ac4abd7741779868adf1,8,1,6,1,Popular read reveal.
DS-004,completed,3aa3f5c5ad35403d89c23f96,2024-07-12 23:01:17,2024-08-05 23:01:17,31fbfe6566fb42e08da73c8c,6,7,3,1,Check into region support enjoy level policy.
DS-004,completed,3aa3f5c5ad35403d89c23f96,2024-07-12 23:01:17,2024-08-05 23:01:17,8ce8aaaccc4440189dcdd801,3,9,4,4,Anyone common when practice development read customer.
DS-004,completed,3aa3f5c5ad35403d89c23f96,2024-07-12 23:01:17,2024-08-05 23:01:17,91add07646fb4ce6946dbcec,4,1,8,3,Teacher thus truth next.
DS-004,completed,3aa3f5c5ad35403d89c23f96,2024-07-12 23:01:17,2024-08-05 23:01:17,085039cb87e74cb189deda89,3,8,1,8,Develop scientist allow.
DS-004,completed,3aa3f5c5ad35403d89c23f96,2024-07-12 23:01:17,2024-08-05 23:01:17,3cea9ac08be24d01ac861095,5,4,4,3,Dark act fight size score.
UI-005,completed,cf718ad4722e4736bcfbab26,2024-09-08 07:00:34,2024-10-04 07:00:34,f3b420628f6f4d789556393b,1,7,3,2,Significant senior large over.
UI-005,completed,cf718ad4722e4736bcfbab26,2024-09-08 07:00:34,2024-10-04 07:00:34,98775e1b7a4145a9aca74015,6,9,5,2,Event smile option him fall wall billion perhaps.
UI-005,completed,cf718ad4722e4736bcfbab26,2024-09-08 07:00:34,2024-10-04 07:00:34,56a097d876c3494fbcd3203b,7,8,5,7,Rock time listen opportunity woman natural.
UI-005,completed,cf718ad4722e4736bcfbab26,2024-09-08 07:00:34,2024-10-04 07:00:34,f12ece20b0004c929841d4bc,5,5,8,4,Debate become decide civil teacher east.
UI-005,completed,cf718ad4722e4736bcfbab26,2024-09-08 07:00:34,2024-10-04 07:00:34,7c2759d776cc403ba0e338e6,3,7,0,10,Within offer choice time through.
UI-005,completed,cf718ad4722e4736bcfbab26,2024-09-08 07:00:34,2024-10-04 07:00:34,08e2dc3b7b3747abbabca52f,4,1,4,10,Himself easy difference serve center turn.
UI-005,completed,cf718ad4722e4736bcfbab26,2024-09-08 07:00:34,2024-10-04 07:00:34,d0f93447ea854215bd750ff9,1,9,8,1,Amount art how rate.
UI-005,completed,cf718ad4722e4736bcfbab26,2024-09-08 07:00:34,2024-10-04 07:00:34,7436622c505043e386dc6b92,5,5,1,0,Size authority test list impact.
UI-005,completed,cf718ad4722e4736bcfbab26,2024-09-08 07:00:34,2024-10-04 07:00:34,2f786cdf3ff9465ca7c91cd4,6,3,9,4,Daughter during get resource computer night.
UI-005,completed,cf718ad4722e4736bcfbab26,2024-09-08 07:00:34,2024-10-04 07:00:34,ba3741715c0b423faeea9c64,7,9,1,3,Lay fast exist kid car why wear cause.
UI-005,completed,cf718ad4722e4736bcfbab26,2024-09-08 07:00:34,2024-10-04 07:00:34,e7dac1b2cf064feb9fc51ca8,8,6,4,2,Game despite loss week what.
UI-005,completed,cf718ad4722e4736bcfbab26,2024-09-08 07:00:34,2024-10-04 07:00:34,7d74459f98e54ac58dde335f,4,7,6,9,Money international responsibility surface station wind.
UI-005,completed,cf718ad4722e4736bcfbab26,2024-09-08 07:00:34,2024-10-04 07:00:34,3dcf011f891a45bc83981b8d,8,10,7,3,Past everyone whose.
UI-005,completed,cf718ad4722e4736bcfbab26,2024-09-08 07:00:34,2024-10-04 07:00:34,25133e6898c6468fb0a710b8,9,10,1,2,Wall almost network man study moment.
UI-005,completed,cf718ad4722e4736bcfbab26,2024-09-08 07:00:34,2024-10-04 07:00:34,8d5d8bca5a5a457d99b7cb89,7,4,4,1,Not national themselves result doctor young report.
UI-005,completed,cf718ad4722e4736bcfbab26,2024-09-08 07:00:34,2024-10-04 07:00:34,943bdb96c4244175ab1f9b94,6,10,0,2,Top hand my sister.
UI-005,completed,cf718ad4722e4736bcfbab26,2024-09-08 07:00:34,2024-10-04 07:00:34,08a73504719b417f9b974bbe,4,8,7,9,New court professor crime maintain eat wait story.
UI-005,completed,cf718ad4722e4736bcfbab26,2024-09-08 07:00:34,2024-10-04 07:00:34,34f05a2985da4fd39d1afe75,2,1,3,10,Skin accept throughout act.
UI-005,completed,cf718ad4722e4736bcfbab26,2024-09-08 07:00:34,2024-10-04 07:00:34,62bbf5482c274d408737fa4d,6,1,1,2,Phone southern discuss keep according environmental.
UI-005,completed,cf718ad4722e4736bcfbab26,2024-09-08 07:00:34,2024-10-04 07:00:34,d1b95a2c238447fe9ee4220f,5,1,10,9,Tonight loss item go event.
UI-005,completed,cf718ad4722e4736bcfbab26,2024-09-08 07:00:34,2024-10-04 07:00:34,298a22b4753542d39cefeac4,10,2,2,7,Same their million every indeed pattern.
UI-005,completed,cf718ad4722e4736bcfbab26,2024-09-08 07:00:34,2024-10-04 07:00:34,9850c692b77b4682a161c0c8,7,3,7,1,Whom early increase before represent.
UI-005,completed,cf718ad4722e4736bcfbab26,2024-09-08 07:00:34,2024-10-04 07:00:34,5f2c5a67682e4441ac8cb558,1,1,8,1,Gun campaign figure.
UI-005,completed,cf718ad4722e4736bcfbab26,2024-09-08 07:00:34,2024-10-04 07:00:34,bb51b03983004db896c50c71,2,4,4,7,Own conference benefit cover.
UI-005,completed,cf718ad4722e4736bcfbab26,2024-09-08 07:00:34,2024-10-04 07:00:34,d91f2c596d664c378d10ec6a,2,8,5,7,Turn but present car short base food.
UI-005,completed,cf718ad4722e4736bcfbab26,2024-09-08 07:00:34,2024-10-04 07:00:34,c771f42b1edd4d25b7ffa88f,1,4,8,8,Six garden daughter effort operation three yourself likely.
DS-006,ongoing,c76226e51b37475cb1aae562,2024-06-12 11:26:31,2024-07-01 11:26:31,5e71289182d549cfbbfdf255,9,6,6,5,Pretty together modern where exactly dog day.
DS-006,ongoing,c76226e51b37475cb1aae562,2024-06-12 11:26:31,2024-07-01 11:26:31,3d854ba3d4f8452ea9ef5167,7,2,4,7,Next however happy.
ST-007,completed,f6f7a277c50e4e249c4e79a4,2024-09-19 06:32:22,2024-10-16 06:32:22,84bfd45bbc6041abb3ee0286,4,3,5,7,Shake free husband second nice.
ST-007,completed,f6f7a277c50e4e249c4e79a4,2024-09-19 06:32:22,2024-10-16 06:32:22,7933a149cd374f49b712976a,1,4,9,6,Discuss indeed professional consumer let.
ST-007,completed,f6f7a277c50e4e249c4e79a4,2024-09-19 06:32:22,2024-10-16 06:32:22,41379ffefb9143d0bc748667,4,2,6,2,Buy impact Mr truth television.
ST-007,completed,f6f7a277c50e4e249c4e79a4,2024-09-19 06:32:22,2024-10-16 06:32:22,64a83955c07141f5829378c3,10,7,10,8,For ten most few similar institution explain.
ST-007,completed,f6f7a277c50e4e249c4e79a4,2024-09-19 06:32:22,2024-10-16 06:32:22,d9a562860b014fb893828f2b,2,1,3,7,Reason rate process cover trial upon quickly.
ST-007,completed,f6f7a277c50e4e249c4e79a4,2024-09-19 06:32:22,2024-10-16 06:32:22,298a22b4753542d39cefeac4,1,5,6,8,List when knowledge manager.
ST-007,completed,f6f7a277c50e4e249c4e79a4,2024-09-19 06:32:22,2024-10-16 06:32:22,ac18e06f43ef40fbb60661f0,9,8,0,1,Including new music type bar late.
ST-007,completed,f6f7a277c50e4e249c4e79a4,2024-09-19 06:32:22,2024-10-16 06:32:22,c9e0b5faf1e24805a8acf28f,3,3,8,5,Our she responsibility money.
ST-007,completed,f6f7a277c50e4e249c4e79a4,2024-09-19 06:32:22,2024-10-16 06:32:22,71e37dec79dd4e31ad18248a,1,1,7,10,Sing black art economic remember follow force.
ST-007,completed,f6f7a277c50e4e249c4e79a4,2024-09-19 06:32:22,2024-10-16 06:32:22,c062cd66c6e94b43896e8db4,4,1,8,5,Fall that north record way through.
ST-007,completed,f6f7a277c50e4e249c4e79a4,2024-09-19 06:32:22,2024-10-16 06:32:22,6107e029d75f4907b4f02833,8,3,5,0,She such area.
ST-007,completed,f6f7a277c50e4e249c4e79a4,2024-09-19 06:32:22,2024-10-16 06:32:22,18e38ad25de842e8a23e9c36,4,2,9,4,Especially bank under series different.
ST-007,completed,f6f7a277c50e4e249c4e79a4,2024-09-19 06:32:22,2024-10-16 06:32:22,c6433dbebde44a3db863295d,1,7,7,6,No support budget question political key stop.
ST-007,completed,f6f7a277c50e4e249c4e79a4,2024-09-19 06:32:22,2024-10-16 06:32:22,bcfd8aed1bb949aa95445fc0,6,5,3,2,Southern provide sometimes tell management security.
ST-007,completed,f6f7a277c50e4e249c4e79a4,2024-09-19 06:32:22,2024-10-16 06:32:22,1f482af58f4d4805b40ce39a,4,6,2,9,Minute wind production education arrive.
ST-007,completed,f6f7a277c50e4e249c4e79a4,2024-09-19 06:32:22,2024-10-16 06:32:22,d91f2c596d664c378d10ec6a,6,0,2,4,Responsibility brother will help option.
ST-007,completed,f6f7a277c50e4e249c4e79a4,2024-09-19 06:32:22,2024-10-16 06:32:22,504ad7c72f2143c79444aaea,9,9,8,5,Prepare play trouble today.
ST-007,completed,f6f7a277c50e4e249c4e79a4,2024-09-19 06:32:22,2024-10-16 06:32:22,cd17faaf2707408eaa040f70,0,6,4,9,Whom pull of doctor.
ST-007,completed,f6f7a277c50e4e249c4e79a4,2024-09-19 06:32:22,2024-10-16 06:32:22,8578826079754f55aba62e4a,3,3,7,9,Officer eight weight reach.
ST-007,completed,f6f7a277c50e4e249c4e79a4,2024-09-19 06:32:22,2024-10-16 06:32:22,0c331be593ff4900b8a906c3,5,1,6,5,Thousand better strategy next allow among.
ST-007,completed,f6f7a277c50e4e249c4e79a4,2024-09-19 06:32:22,2024-10-16 06:32:22,6904a6e9d8de411a946f1ad6,0,6,4,8,Level ahead rise their religious campaign kitchen lose.
DE-008,completed,b40cfa6966cc46c483066b4b,2024-05-10 12:02:52,2024-05-29 12:02:52,224b32bd7ec64ca989d3476f,10,2,2,8,North him bag himself relationship relationship affect.
DE-008,completed,b40cfa6966cc46c483066b4b,2024-05-10 12:02:52,2024-05-29 12:02:52,480e9a382cc34cd0beca3569,9,8,1,6,Husband head meet research.
DE-008,completed,b40cfa6966cc46c483066b4b,2024-05-10 12:02:52,2024-05-29 12:02:52,504ad7c72f2143c79444aaea,6,1,3,6,Majority crime others indicate here.
DE-008,completed,b40cfa6966cc46c483066b4b,2024-05-10 12:02:52,2024-05-29 12:02:52,2a2eefd57c9d472fb947d89a,1,8,10,5,World against while organization ok less actually.
DE-008,completed,b40cfa6966cc46c483066b4b,2024-05-10 12:02:52,2024-05-29 12:02:52,7654d369b436454893391f2d,8,8,3,8,Good million cover sit.
DE-008,completed,b40cfa6966cc46c483066b4b,2024-05-10 12:02:52,2024-05-29 12:02:52,1718566075aa48a7b337933d,7,3,7,8,Question though similar own information size.
DE-009,ongoing,48539a7d30ad400da869a9dc,2024-02-28 07:56:27,2024-03-01 07:56:27,7a9d71f1c87046808b508605,4,4,2,0,Effort behind check image news describe catch.
DE-009,ongoing,48539a7d30ad400da869a9dc,2024-02-28 07:56:27,2024-03-01 07:56:27,448aedcdd3854ffeb37c06e6,1,7,2,0,Water last mouth mention state.
DE-009,ongoing,48539a7d30ad400da869a9dc,2024-02-28 07:56:27,2024-03-01 07:56:27,38b515b93765497a90823083,6,3,0,6,Exactly management sell consider happen.
DE-009,ongoing,48539a7d30ad400da869a9dc,2024-02-28 07:56:27,2024-03-01 07:56:27,0badbf8235624b6da9eaac7f,5,4,5,6,Commercial green guy test seat or toward.
DE-009,ongoing,48539a7d30ad400da869a9dc,2024-02-28 07:56:27,2024-03-01 07:56:27,89bfe9a0c3954deb97776cc2,7,5,0,4,Too world push parent off through.
DE-009,ongoing,48539a7d30ad400da869a9dc,2024-02-28 07:56:27,2024-03-01 07:56:27,e01c730c649843f68155c3cd,5,3,10,8,Instead bag land cold responsibility machine town available.
DE-009,ongoing,48539a7d30ad400da869a9dc,2024-02-28 07:56:27,2024-03-01 07:56:27,dd0488ef0bcd4226b20ce812,4,7,3,5,Everybody position message team east follow clearly their.
DE-009,ongoing,48539a7d30ad400da869a9dc,2024-02-28 07:56:27,2024-03-01 07:56:27,117929860aeb48b58b0934da,7,0,3,5,Establish college entire.
DE-009,ongoing,48539a7d30ad400da869a9dc,2024-02-28 07:56:27,2024-03-01 07:56:27,b078de32c0324d68af0c9119,4,10,4,8,Home serious into entire approach likely.
DE-009,ongoing,48539a7d30ad400da869a9dc,2024-02-28 07:56:27,2024-03-01 07:56:27,7922b19fa26e428b9af96749,6,4,1,5,Real my ability old ask.
DE-009,ongoing,48539a7d30ad400da869a9dc,2024-02-28 07:56:27,2024-03-01 07:56:27,eade230c3eed4e329a2b67c1,7,10,1,5,Mr join economy particular stop author.
DE-009,ongoing,48539a7d30ad400da869a9dc,2024-02-28 07:56:27,2024-03-01 07:56:27,2a4984b3079d43749cd87d23,1,1,2,9,Interview simple unit gun member drive much their.
DE-009,ongoing,48539a7d30ad400da869a9dc,2024-02-28 07:56:27,2024-03-01 07:56:27,cab5ce777606416e840e06ff,8,9,10,6,Market world behind small issue wrong growth now.
DE-009,ongoing,48539a7d30ad400da869a9dc,2024-02-28 07:56:27,2024-03-01 07:56:27,536effd19ce14e509114a704,3,0,7,6,Security attorney nor deal huge enter them.
DE-009,ongoing,48539a7d30ad400da869a9dc,2024-02-28 07:56:27,2024-03-01 07:56:27,854ab9366a3f454dbfd99c9a,8,10,9,1,Until visit interview support do.
DE-009,ongoing,48539a7d30ad400da869a9dc,2024-02-28 07:56:27,2024-03-01 07:56:27,77c63a4a042d438e9e1f6120,4,10,8,1,Today community huge white.
DE-009,ongoing,48539a7d30ad400da869a9dc,2024-02-28 07:56:27,2024-03-01 07:56:27,e16207cc91a24c5ba153fce0,9,1,7,4,College pressure glass other prepare.
DE-009,ongoing,48539a7d30ad400da869a9dc,2024-02-28 07:56:27,2024-03-01 07:56:27,d354e214822e40d8bbc6a6d4,9,3,7,0,Figure audience student unit pull relationship.
DE-009,ongoing,48539a7d30ad400da869a9dc,2024-02-28 07:56:27,2024-03-01 07:56:27,0f3dd94a7c7046589aa5fa0a,7,2,1,7,Close final rate approach individual company because.
DE-009,ongoing,48539a7d30ad400da869a9dc,2024-02-28 07:56:27,2024-03-01 07:56:27,6e6e4f0808774ef0bef3df0e,4,8,10,1,Response agreement study even bring.
DE-009,ongoing,48539a7d30ad400da869a9dc,2024-02-28 07:56:27,2024-03-01 07:56:27,a62a3259fb9547aa8af2171d,2,4,6,1,Nearly bit pressure as.
DE-009,ongoing,48539a7d30ad400da869a9dc,2024-02-28 07:56:27,2024-03-01 07:56:27,4e1cad23a2bb4ce691b585ca,10,1,5,0,Trial often save lead.
DE-009,ongoing,48539a7d30ad400da869a9dc,2024-02-28 07:56:27,2024-03-01 07:56:27,105563270ab1440c88b597bc,2,8,8,2,Baby himself own risk could him.
DE-009,ongoing,48539a7d30ad400da869a9dc,2024-02-28 07:56:27,2024-03-01 07:56:27,a8116f7170f140fa8dbe2517,4,5,2,4,Reach break off term ask majority.
DE-009,ongoing,48539a7d30ad400da869a9dc,2024-02-28 07:56:27,2024-03-01 07:56:27,92334f72a3904733b5c6702b,1,2,3,3,Question mind answer challenge teach receive herself.
DE-009,ongoing,48539a7d30ad400da869a9dc,2024-02-28 07:56:27,2024-03-01 07:56:27,a3626c79b7ea4163aa3a6dbb,10,6,5,0,Serve model century line necessary act behind.
DE-010,completed,4bf8fb083c014ce8a0dc8775,2024-06-02 04:56:29,2024-06-30 04:56:29,89e9c2c7c17d4f4f88ce4918,10,2,4,5,Especially can cultural under civil authority note whole.
DE-010,completed,4bf8fb083c014ce8a0dc8775,2024-06-02 04:56:29,2024-06-30 04:56:29,dee86a0d172f44dc8fda0f0c,3,6,6,1,Than Republican month wait establish individual suggest.
DE-010,completed,4bf8fb083c014ce8a0dc8775,2024-06-02 04:56:29,2024-06-30 04:56:29,9a6f4817db5447d5b28e7a38,1,2,7,9,School hour firm pick popular.
DE-010,completed,4bf8fb083c014ce8a0dc8775,2024-06-02 04:56:29,2024-06-30 04:56:29,c90688dd63bc49a38901f604,5,6,5,7,She plant describe concern.
DE-010,completed,4bf8fb083c014ce8a0dc8775,2024-06-02 04:56:29,2024-06-30 04:56:29,2a85aa4e81ba45cda1375d23,5,8,5,10,Economic fact last occur clear artist law.
DE-010,completed,4bf8fb083c014ce8a0dc8775,2024-06-02 04:56:29,2024-06-30 04:56:29,8fd5151e0e4741d182ddd0ac,5,9,3,5,Body sea fact increase town head then day.
DE-010,completed,4bf8fb083c014ce8a0dc8775,2024-06-02 04:56:29,2024-06-30 04:56:29,e2634c61d4bf4a38a83902ae,3,0,10,4,Machine matter site rest remain.
DE-010,completed,4bf8fb083c014ce8a0dc8775,2024-06-02 04:56:29,2024-06-30 04:56:29,8db611f5169e402da944c7b9,1,3,6,4,Ok to there let pretty.
DE-010,completed,4bf8fb083c014ce8a0dc8775,2024-06-02 04:56:29,2024-06-30 04:56:29,136d75b8612e4c4fbb1a2167,9,3,9,1,Huge girl make direction sure break.
DE-010,completed,4bf8fb083c014ce8a0dc8775,2024-06-02 04:56:29,2024-06-30 04:56:29,cab2a2dddcf749f8bb1de1f1,7,2,4,7,Art even stage crime statement anything keep.
DE-010,completed,4bf8fb083c014ce8a0dc8775,2024-06-02 04:56:29,2024-06-30 04:56:29,caee3a7377c448bcaf6ed1cd,8,4,1,5,Add foreign determine morning clearly skill two.
DE-010,completed,4bf8fb083c014ce8a0dc8775,2024-06-02 04:56:29,2024-06-30 04:56:29,b39557b0c5674d0784922348,6,6,9,4,None interesting firm.
DE-010,completed,4bf8fb083c014ce8a0dc8775,2024-06-02 04:56:29,2024-06-30 04:56:29,f2e1411664e446cd9e8c2ab5,9,5,1,7,Amount woman product rise mean.
DE-010,completed,4bf8fb083c014ce8a0dc8775,2024-06-02 04:56:29,2024-06-30 04:56:29,e3cdaee8ac034c84bfc9f8fe,6,6,2,6,Certain source class animal.
DE-010,completed,4bf8fb083c014ce8a0dc8775,2024-06-02 04:56:29,2024-06-30 04:56:29,99d92e197c1c4c94baed33bc,6,1,1,8,Anything wide whose meeting carry true town federal.
DE-010,completed,4bf8fb083c014ce8a0dc8775,2024-06-02 04:56:29,2024-06-30 04:56:29,84bfd45bbc6041abb3ee0286,1,0,7,3,Forget color theory weight network.
DE-010,completed,4bf8fb083c014ce8a0dc8775,2024-06-02 04:56:29,2024-06-30 04:56:29,b64e5581690142549f1f6304,5,9,9,4,Truth sure anyone smile.
DE-010,completed,4bf8fb083c014ce8a0dc8775,2024-06-02 04:56:29,2024-06-30 04:56:29,614f06e190e14ccb97f874eb,2,8,9,1,Sometimes daughter mention old current sister network.
DE-010,completed,4bf8fb083c014ce8a0dc8775,2024-06-02 04:56:29,2024-06-30 04:56:29,b07da6ad6b264ca8a3ad59f8,5,6,6,5,About then surface technology realize main skin.
DE-010,completed,4bf8fb083c014ce8a0dc8775,2024-06-02 04:56:29,2024-06-30 04:56:29,6583a1eb84604382ba329d17,0,5,7,7,Hope protect ball later adult court perhaps.
DE-010,completed,4bf8fb083c014ce8a0dc8775,2024-06-02 04:56:29,2024-06-30 04:56:29,259f38eaed554984bbe21184,9,3,10,7,Notice professor media hold daughter you them.
DE-010,completed,4bf8fb083c014ce8a0dc8775,2024-06-02 04:56:29,2024-06-30 04:56:29,117929860aeb48b58b0934da,5,4,6,4,Run perform improve sense follow future half art.
DE-010,completed,4bf8fb083c014ce8a0dc8775,2024-06-02 04:56:29,2024-06-30 04:56:29,cca22670550c4137896e23b1,7,4,7,9,Mention course real some music defense.
DE-010,completed,4bf8fb083c014ce8a0dc8775,2024-06-02 04:56:29,2024-06-30 04:56:29,3a3d8a30251c4e0aaa392bd3,0,6,4,2,Treatment section many culture employee help film.
DE-010,completed,4bf8fb083c014ce8a0dc8775,2024-06-02 04:56:29,2024-06-30 04:56:29,8578826079754f55aba62e4a,5,5,8,8,Century military letter keep create often lawyer.
DE-010,completed,4bf8fb083c014ce8a0dc8775,2024-06-02 04:56:29,2024-06-30 04:56:29,ac18e06f43ef40fbb60661f0,6,9,5,3,Region senior difficult.
DE-010,completed,4bf8fb083c014ce8a0dc8775,2024-06-02 04:56:29,2024-06-30 04:56:29,b8c5ec6290d8409095e60962,2,0,10,5,Surface oil drop benefit light water.
UI-011,ongoing,908d74ea574c4e58b885e96a,2024-02-29 10:26:28,2024-03-28 10:26:28,33ea71eefbba456487e7947f,0,2,4,5,Activity walk almost research write picture leg.
UI-011,ongoing,908d74ea574c4e58b885e96a,2024-02-29 10:26:28,2024-03-28 10:26:28,d8e086b485644c25a7dab207,1,9,2,3,Part center represent air cultural million like.
